Date,Headline
2016-01-01,Sarah Palin brings much-needed intellectual rigour to Trump ...
2016-01-01,Inside the Sarinah Mall and Starbucks in Jakarta
2016-01-01,Australian Open 2016: Serena Williams vows to return despite loss ...
2016-01-01,Australian Open women's final: Angelique Kerber stuns Serena ...
2016-01-01,Match fixing: Police quiz Australian players and coaches
2016-01-01,Serena Williams' Australian Open outfit brings pop culture to tennis
2016-01-01,Reaction to Chris Gayle comments show times have changed in ...
2016-01-01,Chris Gayle faces Cricket Australia sanctions over controversial ...
2016-01-01,Chris Gayle labelled a 'creep' following controversial interview
2016-01-01,"Ahmed Saad keen to play for Bombers, Brian Lake rules it out"
2016-01-01,Essendon players challenged German laboratory testing in Court of ...
2016-01-01,Essendon CAS verdict: Inside story of why the players were found ...
2016-01-01,Essendon drugs scandal: The background behind the biggest ...
2016-01-01,Essendon guilty verdict: banned players advised of what they can ...
2016-01-01,Essendon CAS verdict: Why the Bombers' penalty was so different to ...
2016-01-01,Essendon CAS verdict: Bombers 34 'definitely' have legal options
2016-01-01,Essendon CAS verdict: Jobe Watson could be stripped of Brownlow ...
2016-01-01,Essendon CAS verdict: Bombers players to miss season 2016
2016-01-01,Essendon supplements saga: Civil action by 'Essendon 34' likely ...
2016-01-01,Melbourne weather: Rain and clouds but the Australian Open will go ...
2016-01-01,Match fixing in tennis: officials to step up corruption fight in wake of ...
2016-01-01,Australian Open 2016: Bec's joy as Lleyton gets set to hang up his ...
2016-01-01,Teenager Sevdet Besim allegedly planned to target police with ...
2016-01-01,Mixed doubles pair adamant they 'gave 100 per cent' and so did ...
2016-01-01,Australian Open 2016: Spain's Carla Suarez Navarro beats ...
2016-01-01,Why Russian-born Daria Gavrilova became an Australian citizen
2016-01-01,Shaun Tait in Twenty20 squad to face India because he's Australia's ...
2016-01-01,Parts of fire-affected Wye River re-opened to residents
2016-01-01,Australian batsman David Warner wins Allan Border Medal 2016
2016-01-01,Former Essendon coach James Hird opens up on AFL spin and how ...
2016-01-01,Family remember 'loving and devoted' Karen Chetcuti after Michael ...
2016-01-01,Missing Whorouly woman Karen Chetcuti: Man in custody
2016-01-01,Victoria Police arrest man over disappearance of Whorouly woman ...
2016-01-01,Convicted rapist says he was the last to see Whorouly mother Karen ...
2016-01-01,School threats: Students evacuated or face lockdowns after threats ...
2016-01-01,Melbourne schools evacuated after threatening phone calls
2016-01-01,"Roger Federer issues warning to Nick Kyrgios, hoses down 'feud ..."
2016-01-01,Review: Dirty Grandpa marks career low for Robert De Niro
2016-01-01,"Australian Open 2016: French star Gael Monfils on sugar, swearing ..."
2016-01-01,Nick Kyrgios says foot injury won't stop him from playing in ...
2016-01-01,Nick Kyrgios withdraws from Kooyong Classic clash with David ...
2016-01-01,Australia Day honours list: Rod Laver receives Companion of the ...
2016-01-01,"Gay marriage bill could pass today, says Opposition leader Bill ..."
2016-01-01,Whitten Legends Game charity to get $1m in TV deal
2016-01-01,Malcolm Turnbull faces nervous wait for US presidential vote
2016-01-01,Backburn may have caused Wye River fire to escape
2016-01-01,Victorian bushfires: Sections of Great Ocean Road reopen for visitors
2016-01-01,New Zealand fall victims named as Stuart Hollaway and Dale ...
2016-01-01,"Jobe Watson feels 'let down', admits former Essendon coach James ..."
2016-01-01,Common camping gear found to house toxic chemicals
2016-01-01,Essendon drugs saga: Ahmed Saad unlikely to join Bombers as top ...
2016-01-01,Two dead as car plummets off EJ Whitten bridge on Western Ring ...
2016-01-01,"Essendon 34: Ryan Crowley joins Bombers, as Power lodge ..."
2016-01-01,Stranded Spirit of Tasmania passengers set sail day after storm
2016-01-01,Investigation launched as Spirit of Tasmania breaks free from ...
2016-01-01,"Broadmeadows tyre fire controlled, smoke a concern"
2016-01-01,Melbourne weather: Spirit of Tasmania crashes into pier in Port ...
2016-01-01,MFB warns residents to close doors and windows as thick smoke ...
2016-01-01,Hawthorn's Jarryd Roughead to miss first half of 2016 season with ...
2016-01-01,One-time great Robert De Niro's career slide hits rock bottom with ...
2016-01-01,Hawthorn AFL footballer Jarryd Roughead marries Sarah Dunn at ...
2016-01-01,Melbourne Stars' all-rounder Adam Zampa enjoying cricket again ...
2016-01-01,Photo finish to decide Big Bash League finals logjam
2016-01-01,"Travis Cloke, Dane Swan 'idiots': Collingwood president Eddie ..."
2016-01-01,Heidi Klum keeps abreast of bra trends to keep boobs in shape
2016-01-01,Woman's Day publishes nude photos of Collingwood footballers ...
2016-01-01,Australian Open 2016: Thanasi Kokkinakis says he's been offered ...
2016-01-01,New licence category for Uber an option for Vic government on ride ...
2016-01-01,Terrence Blewitt: the life and times of an underworld figure
2016-01-01,Remains of armed robber Terrence Blewitt dug up in Thomastown
2016-01-01,Underworld figure Terrence Blewitt's remains found in Thomastown
2016-01-01,Hoon on run after two people killed in Western Ring Road fiery crash
2016-01-01,Mourners gather at site of fatal crash at EJ Whitten Bridge
2016-01-01,Police probe video link to fiery bridge crash
2016-01-01,Essendon fined $200000 for failing to keep a safe workplace
2016-01-01,Police question drug and violence marred Rainbow Serpent ...
2016-01-01,I told you not to speed': crash victims mourned
2016-01-01,Australian Open 2016: Angelique Kerber faced match point in first ...
2016-01-01,Australian Open 2016: Tennis Australia rocked after trio of board ...
2016-01-01,"When it comes to salaries, it's all about location"
2016-01-01,Brunswick Street shop front becomes wall of tributes for Gordon ...
2016-01-01,Police charge man with murder over Fitzroy shop fire
2016-01-01,Police used us as human shields on Tullamarine Freeway say ...
2016-01-01,Woman in insurance dispute with police over Tullamarine roadblock
2016-01-01,Vulnerable magazine queen Nene King fleeced by friend: prosecutor
2016-01-01,Smoke haze from Tasmanian fires reaches Melbourne
2016-01-01,V/Line trains banned from Metro network
2016-01-01,Safety fears as MFB overhauls recruitment process to 'increase ...
2016-01-01,Metro bans V/Line trains from city after train fails to trigger boom gates
2016-01-01,V/Line to provide free travel as compensation for disruptions
2016-01-01,Police reopen 1986 cold case of teen sexually assaulted twice in ...
2016-01-01,Minister tells hospitals they must have virus-free computer systems
2016-01-01,Armed robber Terrence Blewitt fired fatal shot at Graham 'The ...
2016-01-01,NAB banking on trust factor for mobile payment
2016-01-01,"Laver Cup: Pat Cash, Nick Kyrgios doubt Roger Federer-inspired ..."
2016-01-01,Royal Melbourne Hospital attacked by damaging computer virus
2016-01-01,Global warming: Australia urgently needs potent climate policies
2016-01-01,Eddie McGuire calls for finals 'wildcard' for NAB Challenge winner
2016-01-01,Zero tolerance: Andrews to crack down on gay 'conversion' therapy
2016-01-01,Eddie McGuire says NAB Challenge winner should get an AFL ...
2014-01-01,Li Na thanks her Aussie fans after winning the Australian Open
2014-01-01,Anna Kournikova to Eugenie Bouchard: the top 10 glamour girls of ...
2014-01-01,Buzz around tennis teen Eugenie Bouchard reaches new level at ...
2014-01-01,Australian Open tennis crowd at Melbourne Park tipped be a record
2014-01-01,Heartbreak of a ravaged land
2014-01-01,Black Saturday lessons an aid for survival
2014-01-01,Fire threat eases as crews continue to battle Grampians blaze
2014-01-01,Grampians fire conditions the worst since Black Saturday
2014-01-01,More than 1000 tennis fans treated for heat exhaustion
2014-01-01,Fire authorities urge Victorians to act early on high-risk days for ...
2014-01-01,Melbourne Heart became the A-League's richest club overnight after ...
2014-01-01,Predators such as sharks essential for world's health
2014-01-01,"Naked man rescued from washing machine in Mooroopna, Victoria"
2014-01-01,Tony Abbott not willing to confirm boat deal talks
2014-01-01,Blood money? Battle to bring UFC to Victoria
2014-01-01,Indigenous recognition still has a way to go
2014-01-01,Sydney star Adam Goodes wants to stay active to keep eradicating ...
2014-01-01,Adam Goodes: the right man for Australian of the Year
2014-01-01,Survival Day seeks a positive focus on Australia Day
2014-01-01,Sydney Swans champion and Indigenous leader Adam Goodes ...
2014-01-01,Calls to clean out 'bad apples' in building industry over corrupt deals
2014-01-01,Aussie teen Jordan Thompson makes a point against Richard Gasquet
2014-01-01,Vandals target Captain Cook's cottage in Fitzroy Gardens
2014-01-01,Secret files reveal violent A-League antics in our sports capital
2014-01-01,Figure skater Tonya Harding's ex had her Olympic rival Nancy ...
2014-01-01,Indian student numbers plunge after fresh attack
2014-01-01,"Gang targeted people of Indian appearance, court told"
2014-01-01,Hero firefighter Andrew Wood tells how he helped rescue police ...
2014-01-01,Applying heat to Canberra's climate stance
2014-01-01,"Odyssey done, marathon pair put feet up"
2014-01-01,Darcey Freeman thrown from the West Gate Bridge in horrifying ...
2014-01-01,Air New Zealand flight makes emergency landing at Melbourne Airport
2014-01-01,Couples with unexplained infertility could be rushing into IVF: doctors
2014-01-01,Victoria to expunge criminal records of men convicted over gay sex
2014-01-01,Shadow over Shell service stations
2014-01-01,Debate begins on rebuilding the destroyed Stokehouse restaurant
2014-01-01,Iconic Stokehouse restaurant burns down
2014-01-01,Owners vow to return Stokehouse to former glory after the iconic St ...
2014-01-01,Man hands himself into police after Cobram death
2014-01-01,Man's teeth smashed in attack during Edinburgh Gardens New ...
2014-01-01,Sydney real estate agent organised New Year's Eve party that ...
2014-01-01,"Messy New Year's Eve in Edinburgh Gardens, North Fitzroy"
2014-01-01,Five Victorian friends accused of being bikies in Queensland jail
2014-01-01,Stolen one-of-a-kind Rennmax race car discovered in Courtneys ...
2014-01-01,Victoria's teachers reveal what they love and hate about the classroom
2014-01-01,Temperature to plummet as cool change makes its way across Victoria
2014-01-01,Witness claims three cars drove side by side before crash kills two ...
2014-01-01,One-punch killers could face a charge of death by assault
2014-01-01,Melbourne teenager signs lucrative New York Yankees baseball deal
2014-01-01,Hoddle St killer Julian Knight says injured prisoner 'fell over' and ...
2014-01-01,"I am, you are, we are Australian"
2014-01-01,Pop-up cafe to be placed in Stokehouse restaurant site
2014-01-01,VTAC explain what the tertiary offer process is and what to do next
2014-01-01,Boti Nagy's NBL round Rebound #14: Kings' NBA star Sam Young ...
2014-01-01,"Half a decade after Black Saturday, towns are still rebuilding"
2014-01-01,Marysville rises from the ashes five years after Black Saturday
2014-01-01,Accused killer of homeless man was popular grammar boy who ...
2014-01-01,"Theatre review: Private Lives, Melbourne Theatre Company"
2014-01-01,Two men in hospital after shooting rocks Keysborough car park
2014-01-01,GoPro footage belonging to tragic BASE jumper Ashley Cosgriff ...
2014-01-01,Teenager charged with killing homeless man Wayne 'Mousey' Perry ...
2014-01-01,Homeless man 'Mousey' fatally stabbed in Melbourne city park
2014-01-01,Fallen former WCE star Ben Cousins charged with drug offence: report
2014-01-01,Pedestrian killed by train near Keon Park station
2014-01-01,Michael Hutchence death explained: the Coroner's account in his ...
2014-01-01,Iffy squid' pic deemed a hoax
2014-01-01,"Australia Day has more assaults than any other public holiday, say ..."
2014-01-01,"Lessons learned from Black Saturday saved lives, says Premier ..."
2014-01-01,Cop Brett McCormick pleads not guilty to reckless conduct over high ...
2014-01-01,Supermodel mum-to-be Megan Gale gets emergency scan after ...
2014-01-01,Police appeal for information over mystery death of Hieu Nguyen ...
2014-01-01,PSOs do little for train passenger confidence
2014-01-01,Bikies jailed after 'night of terror' where ex-clubmate was tortured
2014-01-01,The spending gap between the AFL's rich and poor has ballooned to ...
2014-01-01,Melbourne lord mayor Robert Doyle backs 'oases' for homeless in ...
2014-01-01,"Girl, 12, undergoes neurosurgery after injured in boat crash on Lake ..."
2014-01-01,Pregnant journalist's death blamed on 'incompetency'
2014-01-01,Lethal's plan to combat congestion
2014-01-01,Mount Buffalo Chalet faces part demolition
2014-01-01,Victorian government promises tougher penalties for parents who ...
2014-01-01,An epidemic of one punch - 10 years on from death of David Hookes
2014-01-01,What happened when a mum forgot her baby was in the car
2014-01-01,Cop-shooting bandit Hakki Atahan meets a bloody end on a 1984 ...
2014-01-01,Fares 'up 22%' in Labor's trains plan
2014-01-01,Home-schooling on the rise
2014-01-01,Power blackouts hit Victoria as mercury climbs — again
2014-01-01,Meltdown as heatwave cripples state's power supply
2014-01-01,Police describe Black Uhlans among most dangerous criminal ...
2014-01-01,Ultimate Fighting Championship taps mat on $50m fight card at Etihad
2014-01-01,Coles and Woolworths defend early sales of hot-cross buns
2014-01-01,Doctor misdiagnosed pregnant journalist who died of rare condition ...
2014-01-01,Lord mayor Robert Doyle says Melbourne's homeless life stories ...
2014-01-01,"Teachers fed up with ill-mannered, undisciplined children"
2014-01-01,Geelong captain Joel Selwood says he'll be fit to play Round 1
2014-01-01,Theatre review: The Bitter Tears of Petra Von Kant
2014-01-01,Chief police reporter Mark Buttler names his favourite crime films for ...
2014-01-01,Cabrini Hospital should have ordered more tests on new mother ...
2014-01-01,Full SuperCoach prices and best buys revealed for Adelaide ...
2014-01-01,Consumers should regularly compare power company prices to ...
2014-01-01,Black Saturday five years on: Where the key players are now
2012-01-01,"Aussie woman, girl tell of being pushed aside by men amid cruise ..."
2012-01-01,Now everyone loves Michael Clarke
2012-01-01,Tennis great Ivan Lendl still teeing off
2012-01-01,Paul Scholes comes out of retirement as Manchester United knock ...
2012-01-01,Australian tries to sell stricken cruise ship Costa Concordia on eBay
2012-01-01,"Brad Wing, cut by the Sandringham Dragons, finds fame as a US ..."
2012-01-01,A jewel in our sporting crown
2012-01-01,Michael Clarke goes from golden boy to mature leader
2012-01-01,Aboriginal tent embassy reveals flimsy fabric
2012-01-01,Novak Djokovic wins chess game with Bishop's spiritual support
2012-01-01,Dirk Kuyt late show sinks Manchester United in FA Cup
2012-01-01,Cruel twist sees Hewitt through to last 32
2012-01-01,Stars out at night to c'mon Lleyton
2012-01-01,Thierry Henry returns to Arsenal on loan
2012-01-01,Will China save Australia?
2012-01-01,Manchester City beat Liverpool 3-0 in Premier League
2012-01-01,Heather Locklear 'going to be just fine' after overdose
2012-01-01,Sri Lanka set to dump Geoff Marsh: report
2012-01-01,Protesters' violence a blight on Australia
2012-01-01,Women hot-foot it to buy Julia Gillard's shoe
2012-01-01,Stars pay tribute to soul legend Etta James
2012-01-01,Kyle Stanley suffers meltdown at Farmers Insurance Open
2012-01-01,Steve Jobs action figure created by InIcons
2012-01-01,Clean up begins as Cyclone Heidi moves on
2012-01-01,Woolworths sales up 5 per cent
2012-01-01,Matthew Wade's golden chance to oust Brad Haddin
2012-01-01,Workers battle Toyota sackings at Altona plant
2012-01-01,Newly bald Cynthia Nixon says she is gay by choice
2012-01-01,Senegalese music star Youssou N'Dour enters presidential race
2012-01-01,Seven woos axed yellow Wiggle Sam Moran
2012-01-01,Tough exit for yellow Wiggle Sam Moran
2012-01-01,Yellow Wiggle Greg Page to return to the band as Sam Moran steps ...
2012-01-01,Kevin Federline released from hospital after collapse on Excess ...
2012-01-01,"Michael Clarke, Ricky Ponting and Michael Hussey saving grace for ..."
2012-01-01,Here's the dirt on Ricky Ponting's charity shirt
2012-01-01,Shane Warne's cycle rage prompts outlaw crackdown by Town Hall
2012-01-01,"Wing cracks in A380 are harmless, says Qantas"
2012-01-01,Alex Fitch wins snowboard bronze at Winter Youth Olympics
2012-01-01,Angelina Jolie buys Brad Pitt a waterfall for Christmas
2012-01-01,Alert on toxic mushrooms after liver-failure deaths
2012-01-01,Former Australian spinner Brad Hogg selected in T20 squad
2012-01-01,Geoff Marsh sacked as Sri Lanka national coach
2012-01-01,"Prisoners arm themselves, climb roof"
2012-01-01,Prison riot rocks Fulham Correctional Centre in Sale
2012-01-01,Artist Damien Hirst connects the dots in global exhibit
2012-01-01,146 jobs to be lost as Heinz closes tomato sauce factory
2012-01-01,Husband charged as body found under backyard slab
2012-01-01,"Exceptional' chef Liu Jun cooked, killed by death cap mushrooms"
2012-01-01,Jim Magilton the new face of Melbourne Victory
2012-01-01,Dick Smith fears the stores he founded will be sold offshore
2012-01-01,Last hope after Ben Cousins' friends despair
2012-01-01,Japan tsunami death toll at 19300
2012-01-01,Brazilian legend Pele says soccer star Lionel Messi is not at his level
2012-01-01,Welcome Back Kotter actor Robert Hegyes dies from 'heart attack'
2012-01-01,Aussies go la-la at G'day USA
2012-01-01,Family puts Luke Wright in the right frame
2012-01-01,Adelaide United coach John Kosmina in love with A-League
2012-01-01,Le Scandale - French label La Redoute uses naked man in kids ad
2012-01-01,"Jarry accused attacked five, court hears"
2012-01-01,Miranda Kerr named new Qantas ambassador
2012-01-01,Actor Liam Neeson considering converting to Islam
2012-01-01,Hundreds protest at D&G photo 'ban' in Hong Kong
2012-01-01,Two teenager hitchhikers killed by a white Nissan 4WD on the Oxley ...
2012-01-01,"Body found, woman missing after suspicious blaze in Mordialloc"
2012-01-01,Home-birth mum's tragic end
2012-01-01,Authorities investigate Ballarat salmonella outbreak
2012-01-01,Transurban CEO Chris Lynch resigns
2012-01-01,Qantas explosion caused by defect - ATSB preliminary report
2012-01-01,"With Warnie vanquished, Ivey's moving all-in at Aussie Millions"
2012-01-01,Macho soldiers of the South Korean Special Warfare Forces ...
2012-01-01,"Molly Meldrum released from hospital, into rehabilition"
2012-01-01,Man who claims to be a donor-sexual virgin has fathered 14 kids
2012-01-01,"Lost traveller tells of long, hot walk to safety"
2012-01-01,Patty Mills sacked as club claims he faked injury
2012-01-01,Why Matty Johns has nothing to hide after Footy Show row involving ...
2012-01-01,School mourns teacher lost saving son from rip
2012-01-01,Melbourne's Christmas Day hailstorm proves costly for Suncorp
2012-01-01,Retailers concerned by slow demand and online sales
2012-01-01,Sydney Sixers captain Steve Smith would like to lead NSW
2012-01-01,"After 11 years, Melbourne couple wait on a Paris court for justice ..."
2012-01-01,Ky Hurst disqualified as Zane Holmes wins Newcastle ironman event
2012-01-01,Lee helps lead Sixers through to Big Bash final
2012-01-01,Sixers through to Big Bash final
2012-01-01,The Project on the move - again
2012-01-01,Noni B defying retail gloom
2012-01-01,Mark Winterbottom breaks ankle during family holiday
2012-01-01,"Woman, 80, critically injured in glider accident"
2012-01-01,California dreamin' for Premier's man Michael Kapel
2012-01-01,Singles face a losing battle on The Biggest Loser
2012-01-01,Crackdown on illegal fireworks
2012-01-01,Police chase ends with two deaths
2012-01-01,Jack Ziebell stakes claim for Kangaroos' top job
2012-01-01,Crash death brings call to end pursuits
2012-01-01,Prominent Australians tell us what Australia Day means to them
2012-01-01,Homeless man 'met a violent death' in St Kilda
2012-01-01,Violent end for troubled young man who couldn't find a bed
2012-01-01,Santos gives nod for $490m WA oil project
2012-01-01,Thiess wins $260m WA port contract
2012-01-01,Chat live with Excess Baggage contestant Kevin Federline
2012-01-01,Summernats could be held in Canberra for next 25 years
2014-09-01,Apple iPhone 6 Australian release sees massive queues in ...
2014-09-01,Hawthorn players and fans party on in wake of back-to-back ...
2014-09-01,"It was the trade that almost started a revolt, it's finished with two ..."
2014-09-01,Four things Hawthorn and Sydney have in common
2014-09-01,People With Disability Australia says rapper Kanye West should ...
2014-09-01,Numan Haider: from teenager to terror suspect
2014-09-01,Black day for black flag after teenage terror suspect's bloody end
2014-09-01,Terror at home: Numan Haider's journey from suburban teen to jihad
2014-09-01,Melbourne terror shooting: Numan Haider 'planned to behead ...
2014-09-01,Terror suspect shot dead after two police officers stabbed in ...
2014-09-01,"Melbourne terror shooting: It's the lone wolf, not the terror cell"
2014-09-01,"Military campaign: Australia to send SAS troops, fighter jets to ..."
2014-09-01,Matt Priddis wins 2014 Brownlow Medal after topping count ahead ...
2014-09-01,Perth student's mathematical model to predict AFL Brownlow winner
2014-09-01,Flashback: Brownlow Medal night's most fashionable WAGS on their ...
2014-09-01,The darkness in the heart of the perfect family as farmer father ...
2014-09-01,Port Adelaide powers back from MCG nightmare against Hawthorn
2014-09-01,Kanye West rushed to Melbourne hospital just hours before his concert
2014-09-01,The greatest game of all: Geelong v North Melbourne 1994
2014-09-01,Chris and Brad Scott's rivalry drove them to succeed now they face ...
2014-09-01,Leading medical ethics academic says performance enhancing ...
2014-09-01,Brad and Chris Scott: Seven things you didn't know about the AFL's ...
2014-09-01,Napthine grants millions in special compensation for East West Link ...
2014-09-01,Tribute Queen show in Frankston for those 'who love good music'
2014-09-01,Muslim leaders continue to betray Australia by condemning Tony ...
2014-09-01,Relive Essendon's 1993 Grand Final win with unseen photos from ...
2014-09-01,Grand Final strip: Tenant denies hiring stripper to perform
2014-09-01,Stripper charged over nude romp in corporate box at AFL Grand Final
2014-09-01,Hazelwood fire cost more than $100 million
2014-09-01,Don't brand Melbourne youth a terrorist: Islamic Council
2014-09-01,Tinder craze: A casual sex cesspool or a swipe right for true love?
2014-09-01,Melbourne investigating whether Mad Monday costumes are Rolf ...
2014-09-01,2014 AFL Grand Final: Tom Jones' rendition of Delilah hits the ...
2014-09-01,The Bachelor's Melbourne contestant Laurina Fleur says Blake ...
2014-09-01,Champion mare Black Caviar gives birth to first foal; mum and bub ...
2014-09-01,"Brownlow Medal 2014 red carpet: Fashion, WAGs and players on ..."
2014-09-01,"Stuart Rattle, Michael O'Neill and the story behind the perfect smiling ..."
2014-09-01,Interior designer Stuart Rattle's partner pleads guilty to murder
2014-09-01,Video of ice addicts shows scenes that look like something out of ...
2014-09-01,Victorian-first sewer tests reveal alarming spread of deadly drug ice
2014-09-01,Woman's head bashed in racial attack on train
2014-09-01,Female harness driver dies at Cranbourne Harness Training Centre
2014-09-01,Five men hand themselves in over alleged South Yarra gang rape
2014-09-01,Victorian drug lord Brok Seckold jailed for killing drug 'cook' Yengo ...
2014-09-01,"Drug boss Brok Seckold jailed 32 years for kidnapping, murdering ..."
2014-09-01,Court in the act - how commuters are defeating myki fines
2014-09-01,Myki fines fail in court
2014-09-01,Nat Fyfe crowned AFL's most valuable player after brilliant season ...
2014-09-01,Gatto hired in Edelsten divorce stoush
2014-09-01,AFL grand final: Goal umpire Chris Appleton goes from betting ...
2014-09-01,Police drop five charges against GWS footballer Toby Greene
2014-09-01,Judge awards former Werribee teacher Peter Doulis $1.27 million ...
2014-09-01,Family tells of World War I hero's 35 years as mental patient in ...
2014-09-01,Schools free to choose their own report cards
2014-09-01,Sex toys investigation into Honey Birdette lingerie retailer after ...
2014-09-01,Train station bins removed in new terror alert security measures
2014-09-01,Rise Up Australia campaign launch attacks Islamic law
2014-09-01,Australian Bartender Magazine Bar Awards: The Emerson wins best ...
2014-09-01,Former teacher Peter Doulis awarded damages over 'unruly' students
2014-09-01,Kingsford Kenny keeping the Sydney Swans' cheer cheer alive
2014-09-01,Sin city ... bringing Melbourne's crime wave under control
2014-09-01,Fake war veterans caught out impersonating soldiers angers RSL ...
2014-09-01,First look: P&O's new ships Pacific Aria and Pacific Eden spell the ...
2014-09-01,Rise Up Australia leader Danny Nalliah calls Islam a 'death cult'
