Date,Headline
2015-03-01,Ritz-Carlton confirmed for Melbourne
2015-03-01,Melbourne CBD's outdoor smoking ban expanded
2015-03-01,Three men charged with murder after body parts found in Melbourne ...
2015-03-01,Thousands rally in Melbourne against Abbott government's ...
2015-03-01,Melbourne Easter weather: Showers and storms forecast for long ...
2015-03-01,Planning minister: skyscrapers make Melbourne's CBD hostile
2015-03-01,Ex-Melbourne Housewife Andrea Moss reveals 'I just wasn't bitchy ...
2015-03-01,Din Tai Fung to open in Melbourne's Emporium
2015-03-01,Breaking the ruler: Melbourne school lets students choose when to ...
2015-03-01,Salvation Army retired General Eva Burrows remembered as 'the ...
2015-03-01,Melbourne terror suspect Adnan Karabegovic to face trial in October ...
2015-03-01,What Perth can learn from Melbourne: Lord Mayor Robert Doyle ...
2015-03-01,Melbourne cops injured after stolen ute smashes into police van
2015-03-01,Four Yeshiva Melbourne leaders stand down after child sex abuse ...
2015-03-01,CiscoLive: 'Stadium Vision' world first for Melbourne's Etihad stadium
2015-03-01,Melbourne IT plans acquisition spree
2015-03-01,Melbourne taxi driver caught on camera abusing young passengers
2015-03-01,Nathan Jones hails Melbourne young gun Christian Salem
2015-03-01,Melbourne: 'Continuous Flow' Design Proposed For Hoddle Street ...
2015-03-01,Melbourne's 'appalling legacy' of poor apartments
2015-04-01,Men arrested in Melbourne over alleged 'ISIS-inspired' Anzac Day ...
2015-04-01,So this is Easter: Melbourne faces off at anti-Islam rally as police on ...
2015-04-01,Anzac Day 2015: Rain fails to deter massive crowds at Melbourne ...
2015-04-01,Police investigate how mother of seven crashed into Melbourne lake
2015-04-01,Al-Furqan Islamic Centre in Melbourne to close its doors after terror ...
2015-04-01,"Sharky Jama, Melbourne male model, reportedly killed fighting with ..."
2015-04-01,Southbank restaurant siege in Melbourne ends with arrest of man ...
2015-04-01,Jeremy Howe could be poached from Melbourne with rival clubs ...
2015-04-01,$9-11b Melbourne Metro Swanston Street project to go ahead ...
2015-04-01,East West Link: Taxpayers hit with $339 million bill as Government ...
2015-04-01,Murder of Melbourne pastry chef Renea Lau one of the worst: Crown ...
2015-04-01,Thousands rally in Melbourne in support of remote Aboriginal ...
2015-04-01,"Anzac Day terror plot 'involved killing cop, shooting rampage' as ..."
2015-04-01,Daniel Andrews announces second river crossing freeway costing ...
2015-04-01,Melbourne Airport ties with Perth for worst in Australia for service
2015-04-01,Melbourne attracts more sporting tourists than anywhere else in ...
2015-04-01,Melbourne musician Daniel Buccheri's best man speech at brother's ...
2015-04-01,Police hunt pervert seen near Melbourne playground
2015-04-01,"Homeless man Scott Miller jailed over murder, rape in Melbourne ..."
2015-04-01,Shane Edwards gathers 24 touches in Richmond's disappointing ...
2015-04-01,Thousands gather in Melbourne's CBD to protest against proposed ...
2015-04-01,Australia's most expensive apartment sells for $25m in Southbank ...
2015-04-01,Man dies after being dropped off at Melbourne hospital with gunshot ...
2015-04-01,South Park creators' Trey Parker and Matt Stone's Broadway hit The ...
2015-04-01,CCTV captures 'cowardly' stabbing of bouncer outside Melbourne ...
2015-04-01,Melbourne plane crash: Two light aircraft collide on runway at ...
2015-04-01,Melbourne IT advances cloud growth plan with 2nd Watch
2015-04-01,Melbourne Demons have selection options after first-up win
2015-04-01,Building contractor 'questions himself every day' over fatal ...
2015-04-01,"Affordability ""deteriorating"" in Melbourne and Sydney: Moody's"
2015-04-01,"Woman punched, sexually assaulted as men hurl abuse at her in ..."
2015-04-01,Finks motorbike gang open Melbourne clubhouse
2015-04-01,Bolivia's Death Road nearly claims Melbourne man after cliff plunge
2015-04-01,Melbourne raids: Police to investigate complaint from Aboriginal ...
2015-04-01,Man charged over cross-dressing robbery of Melbourne service station
2015-04-01,A CSIRO tool shows the expected average climate in your home ...
2015-04-01,Melbourne suburb wants to be declared an independent nation
2015-04-01,"Real Housewives of Melbourne, episode 7 recap: Thriller in Manila ..."
2015-04-01,"True Believers to invade Melbourne once again, March to Etihad"
2015-04-01,Suspicious fire at fourth Melbourne church
2015-04-01,Melbourne city centre blocked by protests over closure of ...
2015-04-01,Real Housewives of Melbourne star Lydia Schiavello's son accused ...
2015-04-01,Emily Bitto wins 2015 Stella Prize for her novel The Strays
2015-04-01,Melbourne Anzac terror plot: Sevdet Besim appears in court over ...
2015-04-01,Melbourne on track to become Australia's biggest city: ABS data
2015-04-01,Three Canadians jailed over Melbourne drug trafficking syndicate
2015-04-01,Non-compliant cladding fuelled Melbourne apartment tower fire ...
2015-04-01,Fire uncovers drug lab in Melbourne CBD apartment
2015-04-01,"Brett Whiteley fake artworks: Accused art conservator, dealer ..."
2015-04-01,"Melbourne docks crime blitz targets bikies, crime gangs"
2015-04-01,Gabi Grecko has been charged with offensive behaviour after she ...
2015-04-01,Enough is Enough rally: Hundreds call for end to violence against ...
2015-04-01,War medals stolen from Melbourne home of veteran who served in ...
2015-04-01,"Five Adelaide Crows, four Melbourne Demons players fined for ..."
2015-04-01,Islamic preacher Junaid Thorne backs Melbourne terror raid suspects
2015-04-01,Sophia Loren in Melbourne for the Alannah and Madeline Foundation
2015-04-01,Frasers Centrepoint in $222m Melbourne tower deal
2015-04-01,Melbourne hacker admits to cyber attacks on Australian government ...
2015-04-01,Anzac Day 2015: Federation Square taken over by a sea of red ...
2015-04-01,From Abbey Road to Melbourne
2015-04-01,Retiring Ron Walker: Melbourne Formula One Grand Prix is ready ...
2015-04-01,"Macquarie Radio Network dominates Sydney, Melbourne airwaves ..."
2015-04-01,"The Wombats, Circa Waves Splendour 2015 Sideshows"
2015-04-01,"Motorcycles in, cars out, in bold parking plan for Melbourne's CBD"
2015-04-01,Cross-dressing thief armed with 'machine gun' robs Melbourne ...
2015-04-01,Melbourne's northern suburbs offer lifestyle and value
2015-04-01,Fairfax: Magic Melbourne staff slashed
2015-04-01,"Real Housewives of Melbourne, episode 9 recap: Gamble's sex ..."
2015-04-01,"Mistress charged with killing boy, woman with garden shears"
2015-04-01,"Real Housewives of Melbourne, episode 10 recap: Gina and ..."
2015-04-01,Police search for man who filmed woman in toilet cubicle at ...
2015-04-01,KISS rock band tipped to open restaurant in Melbourne
2015-04-01,Melbourne church blaze sites house shameful history of abuse
2015-04-01,Drink-driver crashes into home in Melbourne's north
2015-04-01,Melbourne's most prestigious address 101 Collins fights view intruder
2015-04-01,Where can you buy a home in Melbourne on your wage?
2015-04-01,Clarke to captain Melbourne Stars
2015-04-01,Melbourne's apartment sizes face more scrutiny
2015-04-01,Docklands apartment tower fire fuelled by material in building's walls ...
2015-04-01,Singapore developer launches first foray into Melbourne house and ...
2015-04-01,Forensics identify body found in burnt out car as Melbourne man ...
2015-04-01,Ciao factor: Hollywood siren Sophia Loren wows Melbourne for a ...
2015-04-01,Monstrous' suburban skyscraper planned for one of Melbourne's ...
2015-04-01,Former police whistleblower Simon Illingworth swaps gangland ...
2015-04-01,V/Line and Metro clash over state of tracks on busy Melbourne rail line
2015-04-01,"Real Housewives of Melbourne, episode 8 recap: Gina and Jackie's ..."
2015-04-01,Four Melbourne traffic bottlenecks and what VicRoads is doing to fix ...
2015-04-01,30 under 30: meet Melbourne's next generation of writers
2015-04-01,Hundreds of bus services in Melbourne's west and north face being ...
2015-04-01,Cycle Messenger World Championships delivers victory to reigning ...
2015-04-01,Melbourne Comedy Festival 2015: Reviewer Patrick Horan's last ...
2015-04-01,AC/DC Announce New Shows For Sydney And Melbourne
2015-04-01,Just $50 a head will make Melbourne a better city for cyclists
2015-04-01,Online map aims to simplify the hunt for a parking spot in ...
2015-04-01,Women fleeing violence only able to afford one suburb in Melbourne ...
2015-04-01,Metro Rail project: Victorian Premier announces $1.5b towards city ...
2015-04-01,Last ever Camry rolls off the line at Toyota's Altona plant
2015-04-01,Major expansion for Fishermans Bend with new employment precinct
2015-04-01,Teacher at top Melbourne private school quits over 'innuendo-filled ...
2015-04-01,Community legal centres push to remove guns from Victoria's ...
2015-05-01,Teen charged with terrorism offences after Melbourne police raids
2015-05-01,Police slam 'hardcore' soccer fans after clash following Melbourne ...
2015-05-01,Melbourne teen remanded in custody after facing court over alleged ...
2015-05-01,Four things we learned from Victory's 3-0 win over City
2015-05-01,Melbourne Jihadi brides: 12 young women flee suburbs to join IS
2015-05-01,Melbourne is experiencing a housing bubble and reality TV is partly ...
2015-05-01,Port of Melbourne to be privatised with 50-year lease to fund ...
2015-05-01,Andrews Government unveils $22 billion for infrastructure projects in ...
2015-05-01,Melbourne's road and rail users face crush without major upgrades ...
2015-05-01,Police hunt for gunman in Melbourne after shooting near organics ...
2015-05-01,Anti-Islam protesters and anti-racism activists clash in Melbourne
2015-05-01,Melbourne teen Irfaan Hussein dies fighting with jihadis in Middle East
2015-05-01,Good Samaritan assaulted after standing up for Muslim women who ...
2015-05-01,Melbourne City Council orders removal of padlocks from Yarra ...
2015-05-01,Melbourne women's AFL team beats Western Bulldogs by eight ...
2015-05-01,Rare albino sparrow spotted in Melbourne's south-west
2015-05-01,The US Consulate in Melbourne warns terror attack in Australia is ...
2015-05-01,Melbourne put on flood warning
2015-05-01,Ice addict Alfio Granata jailed over six-week rape and torture ordeal ...
2015-05-01,School committee associates flew Adass Israel School principal out ...
2015-05-01,Thousands gather in Melbourne's CBD to protest against proposed ...
2015-05-01,Female gorilla at Melbourne Zoo killed by male in show of ...
2015-05-01,MX axed: how your mobile killed off the freebie paper
2015-05-01,"ASIC chairman Greg Medcraft warns on Sydney, Melbourne ..."
2015-05-01,Melbourne's new tolled tunnel plan gets support from Prime Minister ...
2015-05-01,Two freeway pileups cause havoc in Melbourne's west
2015-05-01,Melbourne terror suspect Sevdet Besim denied bail over alleged ...
2015-05-01,Melbourne auction clearance rate hits year-high
2015-05-01,Melbourne's largest planned 'no smoking' zone to take up entire ...
2015-05-01,Melbourne bridge's 20000 'love locks' to be removed
2015-05-01,Chaos amid the Melbourne Metro Rail Link tunnel revolution
2015-05-01,Sandridge Bridge to become Melbourne's own High Line garden
2015-05-01,Edinburgh Military Tattoo to perform in Melbourne in 2016
2015-05-01,"Melbourne weather: Snow's falling, winter is unofficially here"
2015-05-01,Subcontractor fined over involvement in fatal wall collapse in ...
2015-05-01,CCTV of stalker who chased woman home in Melbourne released ...
2015-05-01,High-rise 'time bomb' warning prompts building safety audit in ...
2015-05-01,Action on Victoria's very small apartments
2015-05-01,Six arrested after ute rams police car in Melbourne
2015-05-01,Melbourne private school Scotch College admits to historical abuse ...
2015-05-01,"Woman's body found in Melbourne's north, man in custody"
2015-05-01,Young Melbourne footballer Mohammed Allouche dies after ...
2015-05-01,Teenager sexually assaulted in her own home in Cheltenham in ...
2015-05-01,Islamic State recruiter makes contact with popular Melbourne sheikh
2015-05-01,Fremantle beats Melbourne by 68 points at the MCG to maintain ...
2015-05-01,Melbourne Freeway Tunnel Twice the Price of Sydney's
2015-05-01,Ancient Coptic Orthodox Church develops new high-rise parish in ...
2015-05-01,"Online date raped three women in Windsor, Melbourne, police allege"
2015-05-01,The Terrifying Clown On Melbourne Trains Has Been Found and ...
2015-05-01,Adam Reynolds injured for Souths as they try and break Melbourne ...
2015-05-01,Melbourne city centre blocked by protests over closure of ...
2015-05-01,Joe Hockey to receive letter from stevedores on Port of Melbourne ...
2015-05-01,Violent teen gang behind 'hundreds' of Melbourne armed robberies
2015-05-01,Level crossings in Melbourne's south-east first to go in election to-do ...
2015-05-01,Melbourne-made double-decker bus ready to rumble when ...
2015-05-01,Protester left hanging from Melbourne building after abseiling fall
2015-05-01,Scary clown apologises to commuters on a Melbourne V/Line train
2015-05-01,Melbourne's Bourke Street re-opened after man jumping on building ...
2015-05-01,How Courtney Barnett's Melbourne songs went global on ...
2015-05-01,Solar power proposal for Melbourne trams challenges coal generators
2015-05-01,Federal Government providing $150m for M80 upgrade in ...
2015-05-01,Melbourne weather: Winter arrives with icy blast; hopes for early ...
2015-05-01,Homeless man jailed for brutal rape and murder of Melbourne ...
2015-05-01,Melbourne United co-owner Larry Kestelman to take control of NBL ...
2015-05-01,Masked thieves targeting Melbourne homes linked to multi-million ...
2015-05-01,Melbourne council City of Yarra considers graffiti tours while cutting ...
2015-05-01,Homeless of Melbourne search for pop-up shop location following ...
2015-05-01,"THE FALSE 9: Tavares says take me to Melbourne, baby"
2015-05-01,Homeless couple set up home under Melbourne bridge as they wait ...
2015-05-01,Victoria Police unveils its new headquarters in Melbourne's CBD
2015-05-01,The faces of Melbourne: which migrants went to which suburbs
2015-05-01,More Sydney-based investors are choosing to buy property in ...
2015-05-01,Jet ski 'hoon' Ivan Maqi jailed over swimmer's death at Port Melbourne
2015-05-01,"Real Housewives reunion recap, part 1: Pettifleur's shock walkout"
2015-05-01,I basically beat the crap out of him': Melbourne karate expert turns ...
2015-05-01,AFL 2015: Essendon's record-breaking 2001 win over North ...
2015-05-01,Shawshank' inmate arrested in Melbourne after 1959 escape
2015-05-01,Melbourne's boom gates disrupt motorists for up to 90 minutes in ...
2015-05-01,Melbourne's 24-hour public transport trial puts government's PSO ...
2015-05-01,Melbourne driver who crashed car and hit pedestrians may have ...
2015-05-01,Life in a windowless box: the vertical slums of Melbourne
2015-05-01,"Melbourne jazz institution Bennetts Lane to close its doors, after 23 ..."
2015-05-01,Man pleads guilty to cannabis trafficking syndicate on domestic ...
2015-05-01,Melbourne offices in demand as offshore money floods in
2015-05-01,End to dry polls for Melbourne cafes and restaurants
2015-05-01,Sniffer dogs to search mental health facilities in Melbourne
2015-05-01,Melbourne's The Espy Is Closing Down For “A Few Months”
2015-05-01,Melbourne CBD car spaces now some of city's hottest real estate
2015-05-01,Watch Melbourne's public transport system move in real time
2015-05-01,A Melbourne Muso's App Is Making House Gigs More Popular Than ...
2015-05-01,Sydney Vs Melbourne ... does Australia need its own Silicon Valley?
2015-05-01,Investment company Imperium Group to buy Melbourne Rebels
2015-05-01,One thousand times over I wish I could just take it back': Mum who ...
2015-05-01,Air India drops Sydney-Melbourne tag flights: non-stop to Delhi
2015-05-01,Melbourne mother crippled by flu jab
2015-05-01,Melbourne mums to be hardest hit by Abbott's PPL attack
2015-05-01,Melbourne drug rehab centre fined for misleading claims its detox ...
2015-05-01,Labor candidate for Melbourne admits 'I look like a Green'
2015-05-01,Melbourne weather: Showers and damaging winds until early next ...
2015-05-01,Sunshine Plaza in Melbourne's west sells for $35 million
2015-06-01,Melbourne prison riot: Heavily armed police confront masked ...
2015-06-01,Snapshot of salaries and house prices shows who can afford to buy ...
2015-06-01,Malaysia Airlines flight forced to return to Melbourne Airport after ...
2015-06-01,Corrupt Malaysia money distorts Melbourne market
2015-06-01,Five talking points: Melbourne v Collingwood
2015-06-01,State of Origin Melbourne: Why Victoria should (will) support ...
2015-06-01,"Melbourne Express Live: Thursday June 18, 2015"
2015-06-01,CFMEU to pay Grocon $3.55m over 2012 Melbourne CBD blockade
2015-06-01,Live NRL: Canterbury Bulldogs v Melbourne Storm
2015-06-01,AFL 2015: Melbourne defeats Geelong by 24 points at Simonds ...
2015-06-01,Melbourne apartment and house falls on the radar: BIS Shrapnel
2015-06-01,Melbourne Demons haunted at Etihad Stadium by rare place in ...
2015-06-01,Families grieve after bodies of missing Melbourne fishermen found
2015-06-01,"Property boom accelerates in Sydney, Melbourne, slide builds in ..."
2015-06-01,Sydney and Melbourne housing bubble stealing oxygen from the ...
2015-06-01,Labor warns it will bypass Parliament to sell Port of Melbourne
2015-06-01,"Melbourne better than Sydney, Monocle Quality of Life survey finds"
2015-06-01,Melbourne IT buys 50.2pc of app developer Outware Mobile for ...
2015-06-01,Snake smugglers thwarted by Melbourne biosecurity officials
2015-06-01,Melbourne commuter chaos after train lines closure
2015-06-01,Imperium Group takes charge of Melbourne Rebels after buying ...
2015-06-01,Melbourne traffic thrown into chaos as protest against closure of ...
2015-06-01,Australians flock to Melbourne as Victoria becomes Australia's ...
2015-06-01,"Titanium, 3D-printed prosthetic jaw implanted in Melbourne man in ..."
2015-06-01,Five more elite Melbourne schools caught in Scotch College get-rich ...
2015-06-01,NSW Premier Mike Baird slams Melbourne as miserable rainy and ...
2015-06-01,Cronk injured in Melbourne win
2015-06-01,"Terror postcodes: Sydney, Melbourne suburbs revealed"
2015-06-01,Unregistered dentist Muhammet Velipasaoglu allegedly worked ...
2015-06-01,World's 50 Best Restaurants 2015: Melbourne's Attica among top ...
2015-06-01,Man dies after being shot in southeast Melbourne
2015-06-01,Rugby league takes over Melbourne
2015-06-01,Pole spears through police divisional van in Melbourne CBD tram ...
2015-06-01,Dramatic police incident in Melbourne CBD shuts down Flinders Street
2015-06-01,Hundreds of shipbuilding jobs under threat at BAE Systems in ...
2015-06-01,Teen girl charged over Melbourne stabbing appears in court
2015-06-01,House prices around the world: Sydney and Melbourne up but Hong ...
2015-06-01,Three more 'illegal' dental clinics uncovered in Melbourne's northern ...
2015-06-01,No reasons' to leave Melbourne: Hogan
2015-06-01,Afghan refugee jailed for eight years for thwarted 'honour killing' in ...
2015-06-01,Ritz Carlton to open Australia's tallest hotel in Melbourne
2015-06-01,"Man racially abused, bashed in 'sickening' attack in Melbourne's ..."
2015-06-01,"Man, 59, arrested over sexual assault of girls in Melbourne in 1980s ..."
2015-06-01,Between Origins: Rugby league's growth in Melbourne
2015-06-01,Monika Radulovic crowned Miss Universe Australia in Melbourne
2015-06-01,Melbourne teacher wrongly imprisoned for child abuse demands ...
2015-06-01,Cyclist killed in collision with truck in Melbourne's west
2015-06-01,"Melbourne men pistol-whipped, Tasered and extorted in Bali"
2015-06-01,Preview: St Kilda vs Melbourne
2015-06-01,Melbourne drive-by shooting blamed on love triangle
2015-06-01,Gabi Grecko marries Geoffrey Edelsten in Vegas style wedding...in ...
2015-06-01,Melbourne's late-night liquor ban relaxed
2015-06-01,Melbourne man charged with ex-wife's murder remanded until October
2015-06-01,G'day' from space: Astronaut snaps Melbourne from International ...
2015-06-01,Melbourne shivers through coldest day in a year
2015-06-01,Melbourne west's metamorphosis defies popular myths
2015-06-01,Young Melbourne mum allegedly murdered by teenage partner
2015-06-01,Urban forest creation guide unveiled in Melbourne in bid to increase ...
2015-06-01,Angus Brayshaw gives Melbourne back-to-back Rising Star ...
2015-06-01,Greek nationals move to Melbourne to escape growing economic ...
2015-06-01,Melbourne auctions maintain Autumn glow into winter
2015-06-01,Family of MH17 Australian victim 'heartbroken' as Melbourne ...
2015-06-01,Melbourne residents in shock after early morning firebomb attack
2015-06-01,Fire at China Bar restaurant in Melbourne's CBD causes $250000 ...
2015-06-01,Winter has come: Melbourne wakes up to freezing temperatures
2015-06-01,Well-dressed goat goes for a ride on Melbourne train
2015-06-01,Melbourne man Joseph Drago jailed for 11 years for killing ...
2015-06-01,Driver sacked after special needs teen left on Melbourne school bus ...
2015-06-01,"Owner appeals for safe return of puppy Ted, stolen in Melbourne ..."
2015-06-01,Melbourne researchers find breakthrough for head and neck cancer ...
2015-06-01,"Cricket Australia says Boxing Day Test will stay at MCG, rejects ..."
2015-06-01,"Jealous' killer Bona Lual, who mutilated estranged wife in ..."
2015-06-01,Melbourne Metro rail project: Drilling begins on Swanston St for new ...
2015-06-01,Rental growth slowdown signals property boom on borrowed time
2015-06-01,Melbourne weather: Winter start breaks coldest June day record
2015-06-01,"Melbourne Abortion Clinic Sick Of Protesters, Goes To Supreme Court"
2015-06-01,Career over for Finnish pilot arrested in Melbourne over tainted money
2015-06-01,Sinkhole opens up in suburban Melbourne street
2015-06-01,Man who raped Melbourne schoolgirl at knifepoint jailed for more ...
2015-06-01,Ron Clarke public memorial service to be held in Melbourne
2015-06-01,Onlooker stabbed in the face as couple argue at Melbourne train ...
2015-06-01,Creator of London's Oyster card could be myki saviour
2015-06-01,Victoria Police officers finding guns 'every two days' in Melbourne's ...
2015-06-01,The 20 things that threaten Melbourne's liveability
2015-06-01,Free wi-fi may soon be available on Melbourne's trams
2015-06-01,A house divided: brothers in Collingwood and Melbourne camps
2015-06-01,Car thieves taunt police in Melbourne's outer east
2015-06-01,Police arrest 35 people during sniffer dog drug swoop at Melbourne ...
2015-06-01,Why Melbourne has the best cafes in the world
2015-06-01,Listen Out 2015 Lineup Announced
2015-06-01,Melbourne Bledisloe Cup: Victoria uses State of Origin success to ...
2015-06-01,Melbourne mansion owners accused of putting on facade for ...
2015-06-01,Melbourne coach Paul Roos won't play blame game over loss to ...
2015-06-01,Five things you can do to help the homeless - today
2015-06-01,Five ways to pop the housing bubble myth in Melbourne
2015-06-01,Din Tai Fung at Emporium in CBD has best dumplings in Melbourne
2015-06-01,Sale of Defence land could help ease Melbourne housing ...
2015-06-01,Tracking device found to have sparked bomb scare for Melbourne ...
2015-06-01,Friends pay tribute to slain Melbourne mother Brittany Shanice Harvie
2015-06-01,Melbourne Named One Of The World's Leading Music Cities
2015-07-01,Drone shows violent clashes between protesters and police in ...
2015-07-01,Real Madrid arrive in Melbourne ahead of International Champions ...
2015-07-01,Australian nurse Adam Brookman lands in Melbourne after returning ...
2015-07-01,Melbourne prison riot: Fire crews respond to Ravenhall cell blaze as ...
2015-07-01,Bronwyn Bishop spends $5000 on 80km charter helicopter flight ...
2015-07-01,Bootylicious building borrows Beyonce's curves
2015-07-01,Melbourne police officer shot by gunman in a car
2015-07-01,"Melbourne Kurds farewell Reece Harding, who died fighting Islamic ..."
2015-07-01,Melbourne tenants feeling the squeeze as rents rise to all-time high
2015-07-01,Salmonella outbreak linked to Melbourne hotel's high tea
2015-07-01,Melbourne mother Annie Nolan's Facebook post about twin ...
2015-07-01,Exclusive: the six problems ruining Melbourne's rail network
2015-07-01,Darcey Freeman inquest: Doctors knew father who threw 4yo off ...
2015-07-01,Melbourne fall over line
2015-07-01,"Melbourne house prices tipped to dive, while Sydney's climb then ..."
2015-07-01,AFL 2015: West Coast Eagles defeat Melbourne Demons by 54 ...
2015-07-01,Melbourne upsets Collingwood by 37 points as Magpies suffer sixth ...
2015-07-01,Orangutan escapes at Melbourne Zoo
2015-07-01,"No new gangland war in Melbourne, police say, despite officer ..."
2015-07-01,Man found with throat cut dies in Crown Metropol hotel in Melbourne
2015-07-01,Melbourne woman who fell pregnant to 12yo boy jailed for sexual ...
2015-07-01,People around the world have been emailing trees in Melbourne to ...
2015-07-01,"Melbourne weather: Showers bring more cold, snow across Victoria"
2015-07-01,Risk of more collapses at Melbourne construction site after nearby ...
2015-07-01,Melbourne Lord Mayor Robert Doyle proposes bike ban for cyclists ...
2015-07-01,Andy Warhol and Ai Weiwei exhibition to open at Melbourne's NGV ...
2015-07-01,"Deaths of 12 young people in Melbourne a 'suicide cluster', Victorian ..."
