Date,Headline
2014-09-01,Sydney fan invasion to give Victoria an extra $10 million boost
2014-09-01,Lifetime Poof Doof bans for clubbers on ice
2014-09-01,Cranbourne under the microscope as 2014 election looms
2014-09-01,Royal Women's Hospital service offering legal advice to domestic ...
2014-09-01,Unique research into dynapenic obesity at Sunshine Hospital ...
2014-09-01,Accident or attention? Ten famous naked (or near enough) moments
2014-09-01,"Nadia Bartel, Jessie Habermann among new breed of WAGs ..."
2014-09-01,Construction companies donate building materials for new world ...
2014-09-01,Haddara 'sergeant at arms' jailed for storing stolen firearms
2014-09-01,Dane Swan celebrates Brownlow night in his Rio jocks getting inked ...
2014-09-01,"Victoria Police apologises, pays compensation to Corinna Horvath"
2014-09-01,Great Cycle Challenge: Leukaemia survivor Charlie's ride for life
2014-09-01,Friendship between Alastair Clarkson and John Longmire formed 27 ...
2014-09-01,Nick Bracks helps others on his road to redemption
2014-09-01,2014 AFL Grand Final: Mark Knight's premiership poster
2014-09-01,Sydney Swans will not stop Stuart Dew from departing to coach
2014-09-01,What it's like to celebrate Christmas on a cruise ship
2014-09-01,Chris Fagan the unsung powerbroker at Hawthorn
2014-09-01,"Tom Jones, Ed Sheeran and Olivia Newton John to perform at 2014 ..."
2014-09-01,"Rising number of children abused in out-of-home care, report reveals"
2014-09-01,Casey Cr Sam Aziz rebuked for Facebook post on Muslims
2014-09-01,Sam Newman: My face tattooed on Dane Swan's butt has enhanced ...
2014-09-01,Sprint star Usain Bolt heads to Melbourne for AFL Grand Final
2014-09-01,"Judge satisfied Bert Wrout stalked, threatened Moran family crime ..."
2014-09-01,Brownlow after-party: Players and WAGs party on at Crown's Club 23
2014-09-01,Award-winning Melbourne tree-saving program 'best in the world'
2014-09-01,Brownlow style queen Rebecca Judd reveals her red carpet dream ...
2014-09-01,Jo Silvagni will walk the red carpet on Brownlow Medal night for the ...
2014-09-01,From Steve Irwin to corrugated iron: the Miss Universe Australia ...
2014-09-01,What happened to the Werribee theme park? 10 grand ideas for ...
2014-09-01,Ambulance Victoria transport hits pensioners in the hip pocket
2014-09-01,"Take a peek: On board Carnival Legend, the newly 'Aussie-fied ..."
2014-09-01,Lord Mayor Robert Doyle rejects CBD shrine to dim sim
2014-09-01,Forgotten Brownlow WAGs: From reality TV stars to soapie starlets
2014-09-01,Digital photography comes to life on 4K TV
2014-09-01,Melbourne becomes the city of soaring skyscrapers – and the envy ...
2016-02-01,Return of Kings leader Daryush Valizadeh vows to go ahead with ...
2016-02-01,Anglican and Uniting churches offer sanctuary to asylum seekers ...
2016-02-01,Cardinal George Pell is the victim of a vicious witch hunt
2016-02-01,Victorian principal risks jail by speaking out about asylum seeker ...
2016-02-01,Premier Daniel Andrews tells Malcolm Turnbull that Victoria will take ...
2016-02-01,Cardinal George Pell responds to reports of investigation into sex ...
2016-02-01,Ballarat abuse survivors head to Rome to see Cardinal George Pell ...
2016-02-01,Tumbleweed plants takeover Wangaratta and block residents homes
2016-02-01,Victorian school says hoax bomb threat call was traced to Nossal ...
2016-02-01,More schools evacuated after fresh hoax bomb threats made
2016-02-01,Melbourne brothers charged after staging hoax drive-by shooting ...
2016-02-01,"Child's arm stuck in vending machine in Lonsdale St, Melbourne"
2016-02-01,Road under Montague Street bridge could be lowered to avoid truck ...
2016-02-01,"Bus crashes in South Melbourne, trapping passengers"
2016-02-01,Passengers trapped in bus on Montague Street after major crash
2016-02-01,Ballarat company Gold Bus defends decision to cover up logo at ...
2016-02-01,Safe Schools program is making a difference
2016-02-01,Caroline Wilson on Garry Lyon: an intensely private and yet public ...
2016-02-01,Billy Brownless fears Garry Lyon's affair with his former wife had ...
2016-02-01,Lyon-Brownless scandal: It's bizarre to still be talking about ...
2016-02-01,Nicky Brownless out of hiding amid bitter feud between ex-husband ...
2016-02-01,"Garry Lyon close friends, family 'furious' with but rallying around ..."
2016-02-01,Revealed: Billy Brownless gutted after learning of Garry Lyon's ...
2016-02-01,Hunt for man who raped Melbourne teenager in her own bed
2016-02-01,Family fights to rebuild memories of suspected Bendigo murder ...
2016-02-01,Former Essendon rookie Hal Hunter to sue club over supplements ...
2016-02-01,Child abuse victim joins vigil in Ballarat
2016-02-01,Matthew Dellavedova says development of Mason Cox should ...
2016-02-01,Salmonella outbreak rises to 62 cases in Victoria from contaminated ...
2016-02-01,Son's childhood friend charged with mother's murder
2016-02-01,$1.4 million promotional event for botched Ultranet project
2016-02-01,How the Ultranet scandal unfolded
2016-02-01,"Girl, 13, drowns while trying to save younger brother in rough surf at ..."
2016-02-01,Cycle network's missing link will finally be built
2016-02-01,Flinders Street Station's $100 million renovation begins
2016-02-01,Bushfire-proof houses burn down in Wye River and Separation ...
2016-02-01,Chiropractor makes no bones about paying undercover cop to have ...
2016-02-01,AFL CEO Gillon McLachlan took home $1.7 million in his first full ...
2016-02-01,White Night 2016: the verdict
2016-02-01,Croatia rape trio part of hyper-masculine bodybuilding subculture
2016-02-01,Talks continuing to secure Phillip Island as Australian base for ...
2016-02-01,AFL 2016: Umpire Eleni Glouftsis breaks a glass ceiling
2016-02-01,"Adam Sandler's classic golf comedy Happy Gilmore turns 20, but ..."
2016-02-01,World-first Australian stem cell marvel that regrows damaged ...
2016-02-01,Human Rights Commissioner Tim Wilson to seek Goldstein ...
2016-02-01,Fury over payment by Melbourne men to avoid rape trial in Croatia
2016-02-01,Cyclists strip off for Melbourne's final nude bike ride
2016-02-01,"Explosion, fire damages Kittens strip club, Caulfield South"
2016-02-01,V/Line train wheel crisis could have damaged Melbourne's tracks ...
2016-02-01,"Cafe Di Stasio hit with claims of visa rorts, bullying and heroin ..."
2016-02-01,"Melbourne Rebels' triple injury blow with Nic Stirzaker, Mike Harris ..."
2016-02-01,Sky train project to start on Pakenham-Cranbourne line this year
2016-02-01,Why are textbooks so expensive in Australia?
2016-02-01,The endless tide of homeless in Melbourne's inner city
2016-02-01,NGV tries to remove equal opportunity and anti discrimination ...
2016-02-01,Geelong rape charge against Rowan Wild dropped
2016-02-01,Nearest school no longer an option for South Yarra family
2016-02-01,Clinton McIver's Amaru in Armadale is serving a celebration of ...
2016-02-01,Could a sky rail arrive in Mernda?
2016-02-01,Behind the persona: Who is the real Garry Lyon?
2016-02-01,Melbourne council destroys Australia's best skate spot for 'little bogans'
2016-02-01,Huge campaign donation offered to Robert Doyle for deputy lord ...
2016-02-01,Military camp ethos prevails in a Maribyrnong detention centre run ...
2016-02-01,West Gate Bridge horror: Police officer sues over Darcey Freeman ...
2016-02-01,Supercoach
2016-02-01,Timid 'slave' Henry Rose is free after he's found not guilty of ...
2016-02-01,Victoria begins talks about Australia's first-ever treaty with ...
2016-02-01,"Mick Gatto raided, charged after fake $100 bill 'coincidence'"
2016-02-01,Hawthorn veteran Sam Mitchell 'awkward' about Jobe Watson's ...
2016-02-01,Shane Warne and other I'm A Celebrity Australia stars allowed to ...
2016-02-01,Will Victoria's desalination plant need to get bigger?
2016-02-01,Promising sprinter Morgan Mitchell sheds kilos and attitude in bid to ...
2016-02-01,Unclaimed money: More than $100 million waiting to be collected by ...
2016-02-01,"Go kill yourself, faggot': Gay teen says Somerville Secondary ..."
2016-02-01,Flammable cladding found on 50 per cent of new Melbourne high ...
2016-02-01,Sunday explainer: citizen's arrest
2016-02-01,Planning the build of your first home
2016-02-01,Victorian sperm donors have lost their anonymity
2016-02-01,Gary Ablett opens up about how his Christianity defines and drives him
2016-02-01,School dumps cut-throat VCE ranking
2016-02-01,East West Link could be revived by Infrastructure Victoria
2016-02-01,Change to Anzac Day march declared out of order
2016-02-01,Australia's drinking culture: Do we have an alcohol problem?
2016-02-01,Graffiti tagger destroys historical Smith Street feminist mural
2016-02-01,"Six sleek Airstreams, $1m and a great big crane transform inner-city ..."
2016-02-01,Australian supermodel Ajak Deng's manager says fashion industry ...
2016-02-01,RMIT turns building's broken glass into ray of sunshine
2016-02-01,Newsreader Peter Mitchell invites us into his home and shares his ...
2016-02-01,Oscars controversy: 10 of the greatest scandals to hit the Academy ...
2016-02-01,The day terror came to Melbourne: The Russell Street Bombing 30 ...
2016-02-01,Cruising without the seasickness: New virtual reality tours give you ...
2016-02-01,Horse-drawn carriage operator filmed hurling violent threats and ...
2016-02-01,Deer Park Football Club set to stream live games featuring former ...
2016-02-01,Melbourne measles outbreak doubled: five new confirmed cases
2016-02-01,Jeff Kennett and friends get kinky to aid beyondblue
2016-02-01,Victoria's first vertical school reaches new heights
2016-02-01,Kennett dons Kinky Boots as musical vows to back his beyondblue ...
2016-02-01,Stephen Jolly leads mass resignation from Socialist Party over ...
2016-02-01,Chompamatic and his ChewCrew spend their weekends binging on ...
2016-02-01,Hugh Sheridan and the California Crooners Club break through in ...
2015-08-01,Adam Goodes: Aboriginal communities and football players show ...
2015-08-01,Border Force fiasco: Operation Fortitude cancelled as protest shuts ...
2015-08-01,"Maggie Kirkpatrick, Prisoner star 'The Freak', found guilty of child sex ..."
2015-08-01,Thousands rally for same-sex marriage
2015-08-01,James Hird apologises to Tania Hird and children for all they've ...
2015-08-01,Should Australia fight terror in Syria?
2015-08-01,"Melbourne named world's most liveable city, for fifth year running"
2015-08-01,"Liveable, but how resilient? Meet Melbourne chief resilience officer"
2015-08-01,Melbourne named world's most liveable city for fifth consecutive year
2015-08-01,Nikki Francis-Coslovich: Dad's desperate text message to save his ...
2015-08-01,Still no answers in death of Mildura toddler Nikki Francis-Coslovich
2015-08-01,Body of Mildura toddler Nikki Francis-Coslovich found in roof cavity
2015-08-01,"Homicide probe into Nikki's death ""very complex"": Police"
2015-08-01,Live: Melbourne tram strike causes commuter disruption
2015-08-01,"AFL club membership grows, but three clubs dropped off"
2015-08-01,"Tyrone Vickery set to stay with Richmond, rejecting lucrative deals ..."
2015-08-01,Salim Mehajer and wife Aysha have the look of physical ...
2015-08-01,Usain Bolt v Justin Gatlin: credibility of track and field hangs on a ...
2015-08-01,Hamish McLachlan: What you didn't know about Danny Green
2015-08-01,Damien Mantach: Liberal Party in shock after $1.5 million fraud ...
2015-08-01,Masa Vukotic's killer Sean Price shocks own lawyers by admitting to ...
2015-08-01,"Murat Shomshe released on bail to marry, then flees"
2015-08-01,Essendon and AFL Players' Association frustrated at fresh ...
2015-08-01,WADA finds 'abnormally' high TB4 levels in Essendon players
2015-08-01,Hells Angels bikies plan big bash to mark 40th anniversary
2015-08-01,Bendigo mosque protest: Anti-mosque and anti-racism protesters ...
2015-08-01,NAPLAN: Education chief warns students not improving
2015-08-01,Virtual reality: How Oculus Rift could change the way students learn
2015-08-01,CBA chief Ian Narev is paid twice as much in a week as most ...
2015-08-01,AFL to launch women's league in 2017 in push to put female football ...
2015-08-01,Big Brother unlikely to return to TV as Dreamworld house dismantled
2015-08-01,Melbourne commuters face tram strikes as tension builds over Metro ...
2015-08-01,Michael Firrito becomes just the 10th Kangaroo to play 250 games
2015-08-01,Delays tipped for international passengers at Melbourne Airport as ...
2015-08-01,"Teenage girl killed, man fighting for his life after car crash in Kew"
2015-08-01,Charter schools would boost grades in Australia: new report
2015-08-01,Langham Hotel salmonella outbreak caused by raw egg mayonnaise
2015-08-01,Prominent Catholic priest Father Julian Fox jailed for child sex crimes
2015-08-01,"Paedophile priest found guilty of sex, physical assaults at Salesian ..."
2015-08-01,Students clash with Christopher Pyne's security staff during Victoria ...
2015-08-01,Protesters free to demonstrate outside Melbourne Fertility Clinic
2015-08-01,David Zaharakis opens up about deflating Essendon drugs saga
2015-08-01,Lights out for smoking in outdoor dining areas
2015-08-01,Plasterer pleads guilty to stabbing couple to death in their Moonee ...
2015-08-01,Religious instruction scrapped from curriculum
2015-08-01,For and against same-sex marriage equality
2015-08-01,Crane collapse: Emergency crews called to Southbank building site ...
2015-08-01,Concrete mix to be pumped beneath Yarra to stabilise ground for ...
2015-08-01,Police target Coffin Cheaters outlaw motorcycle gang in pre-dawn ...
2015-08-01,Police raid Coffin Cheaters bikie clubhouse in Braeside
2015-08-01,Victoria aims for 20 per cent renewable energy target by 2020
2015-08-01,What will Melbourne be like in 180 years time?
2015-08-01,Melbourne weather: Coldest winter in 26 years keeps a tight grip on ...
2015-08-01,180 years of Melbourne: The Age's 8 most dramatic front pages ...
2015-08-01,VCE Text review: Burial Rites by Hannah Kent
2015-08-01,Treated like dogs': Australian Border Force raids Maribyrnong ...
2015-08-01,Robert Farquharson: The dad who killed his three sons by driving ...
2015-08-01,A lot of white: your guide of what to wear for the spring carnival
2015-08-01,Michael Leunig defends 'fascist epiphany' vaccination cartoon
2015-08-01,"Systematic disgrace': Directors convicted, fined for unhygienic ..."
2015-08-01,Melbourne Day: Seven things you must do in our city
2015-08-01,Where to find Melbourne's 10 best dumplings
2015-08-01,Calls for ban after horse pulling carriage of six bolts in CBD
2015-08-01,Adults count the cost of poor maths
2015-08-01,"Kerry Stokes shares his art collection, including $15.5m Rothschild ..."
2015-08-01,Hawthorn flag would be one from the heart
2015-08-01,Mick Gatto targeted in gangland hit
2015-08-01,Sunday explainer: why women's sport is big right now
2015-08-01,The world's wackiest festivals
2015-08-01,Melbourne Spring Fashion Week goes kitsch with Crikey! pop-up shop
2015-08-01,Fraying on the fringe: Dealing with disadvantage in Mernda
2015-08-01,"Brendan Fevola to leave Yarrawonga Pigeons, returning to Melbourne"
2015-08-01,"Theatre review: Antigone, Malthouse Theatre"
2015-08-01,Lance Picioane: the footy player lending a hand against depression
2015-08-01,Euthanasia drug 'Lethabarb' stolen from Melbourne vet clinic
2015-08-01,Mental health in Australia: The government fiddles while young ...
2015-08-01,Deaf trio committed to stand trial for murder of deaf man who fell to ...
2015-08-01,Melbourne outer suburbs: Government's new plan to tackle city ...
2015-08-01,Sacked Grill'd worker Kahlani Pyrah receives payout from burger ...
2015-08-01,Heat pump' tech could save Victorian homes up to $658 a year on ...
2015-08-01,The war on myki: Julian Burnside QC leads legal team to help ...
2015-08-01,Melbourne's 180th birthday: How old suburbs of the west have ...
2015-08-01,A fast and furious lifestyle': police concern over next generation ...
2015-08-01,Food truck fervour is rolling further north with Preston pegged for a ...
2015-08-01,Prison riots lead to dangerous maximum security prisoner reshuffle ...
2015-08-01,Neo-Nazi group Combat 18 plasters anti-Islam stickers over ...
2015-08-01,"Modern maths: no textbooks, year levels or rote learning"
2015-08-01,How does your maths compare to a Grade 5 kid?
2015-08-01,Woolworths Laverton workers strike over labour hire casualisation
2015-08-01,"Victoria could ramp up debt to pay for new projects, says Treasurer ..."
2015-08-01,In-flight safety videos getting more creative as Hawaiian Airlines ...
2015-08-01,VCE text review: Life of Galileo by Bertolt Brecht
2015-08-01,"P&O Cruises introduces 'The Pantry', to replace the traditional cruise ..."
2015-08-01,Maps of Melbourne suburbs from 1800s reveal how far we've come
2015-08-01,"Mothers expect daughters, not sons, will get university degrees"
2015-08-01,Hells Angels homeless after clubhouse eviction on Mornington ...
2015-08-01,Can't find a car park at the train station? Here's 500 reasons why
2015-08-01,Black Saturday hero Sergeant David Key calls it quits
2015-08-01,Isaac Heeney's journey from the farm to the Sydney Swans
2015-08-01,Retiring forecaster Terry Ryan reveals nine things he's noticed about ...
2013-09-01,Paul Roos named Melbourne Demons AFL coach
2013-09-01,Paul Roos recruits former Sydney development coach Brett Allison ...
2013-09-01,Adam Bandt claims victory for Greens in seat of Melbourne
2013-09-01,Freo land in Melbourne
2013-09-01,Singapore firms buy up Melbourne sites
2013-09-01,Melbourne Demons denied priority pick in national draft by AFL
2013-09-01,Church dumps rebel priest
2013-09-01,Worst winds in five years cause chaos and damage across Melbourne
2013-09-01,Massive haul of ephedrine found hidden in rice shipped to Melbourne
2013-09-01,"One Direction's Niall Horan holidaying in Melbourne, Twitter ..."
2013-09-01,Jill Meagher remembered as thousands march down Sydney Road ...
2013-09-01,1.5 million reasons why Paul Roos will pay his way at Melbourne
2013-09-01,Melbourne lodges application for draft help
2013-09-01,Melbourne carbon-reduction plan 'best in the world'
2013-09-01,David Samuel Cyprys convicted of child sexual abuse at ...
2013-09-01,Fire crews contain large blaze at Melbourne factory
2013-09-01,Josh Mahoney is Melbourne's new football operations boss
2013-09-01,South Sydney Rabbitohs beat Melbourne Storm 20-10 to advance to ...
2013-09-01,Melbourne's yellow taxis get a makeover to increase competition
2013-09-01,Melbourne says pick two is on table; Dustin Martin may yet be a ...
2013-09-01,Jones goes back-to-back in B&F
2013-09-01,Fare evasion on Melbourne public transport increases with myki
2013-09-01,Newcastle Knights beat Melbourne Storm 18-16 to advance to NRL ...
2013-09-01,Car parking costs in Melbourne CBD soar with more increases on ...
2013-09-01,Man who killed Irish backpacker gets 18 years
2013-09-01,Anarchists claim responsibility for fire at luxury West Melbourne car ...
2013-09-01,A history of Melbourne: The best and worst moments
2013-09-01,Sun rises on Brosnan's Australian film shoot
2013-09-01,Health funding cuts blamed for mystery illness that swept through ...
2013-09-01,Melbourne woman Catherine Whitty fights Prada after champagne ...
2013-09-01,"Uniqlo to open first Australian store, on Lonsdale St in Melbourne"
2013-09-01,Dormitory city: Melbourne's brittle highrise apartment boom
2013-09-01,ST&P merges with M&C Melbourne
2013-09-01,Melbourne to become land of the lemurs
2013-09-01,Major power outages cause blackouts across Melbourne's eastern ...
2013-09-01,Brent McGrath playing for Melbourne Heart deal
2013-09-01,North Melbourne 2013 Report Card
2013-09-01,Recollections of hoppier times sought for memoir of a long-gone ...
2013-09-01,Would you live in a loo?
2013-09-01,"Optus adds TD-LTE 4G in Sydney, Melbourne, Brisbane"
2013-09-01,Melbourne faces wild weather as wind sweeps across Victoria
2013-09-01,Quicker trams will keep Melbourne on track to success in future
2013-09-01,Inside Dolce & Gabbana's new Melbourne store
2013-09-01,The notorious Sunshine Crew menaced Melbourne at the height of ...
2013-09-01,Melbourne named as Australia's fastest-growing city according to ...
2013-09-01,"Listen Out 2013 Releases Set Times For Brisbane, Melbourne, Perth ..."
2013-09-01,Seat of Melbourne voters line up to grill candidates
2013-09-01,New private hospital proposed for Melbourne's south-eastern suburbs
2013-09-01,Grey race series to honour former Melbourne Cup champion Subzero
2013-09-01,Melbourne artist faces child pornography charges over seized works
2013-09-01,Luxury townhouses bring together Melbourne design talents
2013-09-01,Two found dead in separate incidents in Melbourne's eastern suburbs
2013-09-01,Taxi row leads to brutal assault outside Hilton Hotel in East Melbourne
2013-09-01,Melbourne boxer Will Tomlinson flees Mexico after being caught up ...
2013-09-01,The international ring that fixed a Melbourne footy game
2013-09-01,Walden to retire as face of Ten News Melbourne
2013-09-01,Pinjarra the 750kg saltwater crocodile retires to Melbourne Aquarium
2013-09-01,Masterchef pop-up restaurant comes to Melbourne for the first time
2013-09-01,Melbourne brothel worker offered hush money to murder victim's ...
2013-09-01,Police fear Melbourne shootings are the result of escalating bikie ...
2013-09-01,Greece's top Benaki collection to go on display in Melbourne
2013-09-01,Sydney food franchises hunger for Melbourne
2013-09-01,Hells Angels clubhouse in Seaford sprayed with bullets as bikie ...
2013-09-01,"Jerry Hall opens up about modelling, motherhood and seducing ..."
2013-09-01,Michael Mifsud arrives to join Melbourne Heart
2013-09-01,Victoria Police evaluate hoon investigation team in Melbourne's ...
2013-09-01,Melbourne Storm forced to dig deep with golden point as Titans ...
2013-09-01,Old Melbourne hotel gets heritage permit
2013-09-01,Mathews latest to join Roos at Melbourne
2013-09-01,Greens' ground zero: on the election Bandtwagon in Melbourne
2013-09-01,"The Drones – The Hi-Fi, Melbourne, 13/09/13"
2013-09-01,North Melbourne emerge as leading candidate to snare Saint Nick ...
2013-09-01,Melbourne's Brownlow history
2013-09-01,Hells Angel bikie Peter 'Skitzo' Hewat allegedly punched 62yo ...
2013-09-01,Melbourne: An inside look at one of the world's most sustainable cities
2013-09-01,Wiz Khalifa And A$AP Rocky Announce Melbourne Gig
2013-09-01,Taxation law masters student Gethara Somasundaram jailed for two ...
2013-09-01,"VIC: Commercial sale, 472 Bourke Street, Melbourne"
2013-09-01,Melbourne actor Jarrod Reuven Factor jailed for procuring minors ...
2013-09-01,The hottest pies in Melbourne
2013-09-01,Australian start-up has Adobe in sight
2013-09-01,Year-round laughs at Melbourne's comedy hotspots
2013-09-01,Melbourne's green spaces are pure gold
2013-09-01,Foreteller defeats Melbourne Cup favourite Puissance De Lune to ...
2013-09-01,Best for bacon: Melbourne
2013-09-01,"Martin Hughes, Lloyd Jones, Margaret Evison"
2013-09-01,The best and worst reviews of Melbourne's favourite restaurants
2013-09-01,Merger to drive golf clubs into future
2013-09-01,How Adam Garrisson saved Melbourne mansion Redcourt
2013-09-01,Hidden gems: 18 places to see in Victoria
2013-09-01,Melbourne team uncovers multiple sclerosis breakthrough
2013-09-01,Hunters & Collectors Announce First Australian Tour Since 1998
2013-09-01,Top five Melbourne warehouse conversions on the market
2013-09-01,"LIVE REVIEW: Snakehips @ The Liberty Social, Melbourne"
2013-09-01,"Valentino, Melbourne restaurant review"
2013-09-01,Melbourne: The parasite economy
2013-09-01,Redundancies follow budget blow-out at Arts Centre Melbourne
2013-09-01,"Julia Zemiro, Ute Lemper, Archie Roach and Craig Pilkington"
2013-09-01,Blair switch project breathes fresh life into Melbourne
2013-09-01,State grows by 100000 people a year
2016-10-01,Lucky punter who turned $10 into $240k highlights biggest Cup wins
2016-10-01,Melbourne Storm vs Cronulla Sharks in the NRL grand final at ...
2016-10-01,World reacts to Tim Cahill's incredible 35-metre goal on Melbourne ...
2016-10-01,Caltex Socceroos training session in Melbourne
2016-10-01,Melbourne weather: Damaging winds cause chaos throughout Victoria
2016-10-01,FFA Cup final set to be sky blue after Melbourne City defeat ...
2016-10-01,Where are all the celebrities at Melbourne Cup Carnival 2016?
2016-10-01,Developers 'will rebuild' historic Corkman pub in Melbourne after ...
2016-10-01,Jordan Lewis to Melbourne trade: Hawthorn veteran completes ...
2016-10-01,Strong early spring for Melbourne home prices as values rise again
2016-10-01,Violence erupts between Melbourne and Adelaide A-League fans ...
2016-10-01,Melbourne's 2017 fixture announced
2016-10-01,Jordan Lewis must leave Hawthorn and join Melbourne to prolong ...
2016-10-01,Melbourne rugby player gets 12 years' jail for attempting to rape six ...
2016-10-01,Historic Carlton pub unlawfully demolished; fine increase for ...
2016-10-01,Melbourne shootings a 'very stark' reminder of dangers police face ...
2016-10-01,Michelle Payne missing out on the Melbourne Cup has nothing to do ...
2016-10-01,"Home prices keep rising, Melbourne overtaking Sydney"
2016-10-01,Two girls fighting for life after fatal Melbourne crash
2016-10-01,Melbourne to meet Saints in round one
2016-10-01,Congestion tax: How would a tax to reduce Melbourne's road traffic ...
2016-10-01,Derby Day 2016: Melbourne shines for first day of Cup week racing
