Date,Headline
2016-10-01,Melbourne Cup 2016: Logjam with 32 runners still in contention for ...
2016-10-01,That Banksy Stencil of Pauline Hanson in Melbourne is a Fake
2016-10-01,"High winds to sweep through Melbourne, Victoria"
2016-10-01,Melbourne jewellery shop manager confronts masked robbers
2016-10-01,Driverless car built in Melbourne by Bosch engineers at Clayton is ...
2016-10-01,"Victoria weather: Damaging winds return, triggering October's 50th ..."
2016-10-01,Brisbane Melbourne Cup: Eagle Farm power outage chaos
2016-10-01,Woman dies after Melbourne apartment fall
2016-10-01,A-League: Melbourne Victory thrash Wellington Phoenix
2016-10-01,Melbourne weather: More than 1000 households lose power after ...
2016-10-01,Man fatally stabbed in Melbourne
2016-10-01,Melbourne Lord Mayor Robert Doyle wins third term in 2016 council ...
2016-10-01,"Tram collides with van in Melbourne, injuring students"
2016-10-01,Vigilante-style group Soldiers of Odin patrolling Melbourne CBD
2016-10-01,Jesse Hogan has re-signed with Melbourne on a two-year contract ...
2016-10-01,Melbourne's nasty media needs to be challenged
2016-10-01,Moody's warns of potential apartment glut in Melbourne
2016-10-01,Ex-Bomber lands at Melbourne
2016-10-01,Four teenagers stabbed during 'organised brawl' at Melbourne fast ...
2016-10-01,Toilet paper covers Melbourne freeway causing traffic havoc
2016-10-01,Melbourne's median house price jumps 3.1 per cent over the ...
2016-10-01,"Drive-by shooting in Beacon Vista, Port Melbourne"
2016-10-01,Melbourne United shoots wide as Damian Martin leads Perth ...
2016-10-01,Hocking Stuart Richmond fined for underquoting Melbourne properties
2016-10-01,Traffic congestion: Uber trip data shows big projects have slowed ...
2016-10-01,Hartnell brings Sydney form to Melbourne
2016-10-01,Melbourne United strongly denies rampant 'NBL import sacking ...
2016-10-01,Kinky Boots' jaunty and engaging tone set to win Melbourne ...
2016-10-01,Caulfield Cup winner Jameka to carry 53.5kg in Melbourne Cup ...
2016-10-01,Squatters evicted from Melbourne homes
2016-10-01,Hot Melbourne property auction market galloping ahead
2016-10-01,Melbourne weather: Coldest Cox Plate day since 1970
2016-10-01,Melbourne jockey Danny Nikolic's ban on attending racetracks ...
2016-10-01,Melbourne blackout as wild winds lash Vic
2016-10-01,Fast 5 netball: Australian Diamonds to unleash Gretel Tippett in ...
2016-10-01,Melbourne firefighters save tiny black kitten from Rebels bikie gang ...
2016-10-01,Robbie Tarrant wins first Syd Barker Medal as North Melbourne ...
2016-10-01,Man on the run after Melbourne shooting
2016-10-01,A Melbourne Airport monorail that will get travellers to the city in 16 ...
2016-10-01,Hyperloop: high-speed rail network that could come to Australia
2016-10-01,Last Melbourne made Fords auctioned in Vic
2016-10-01,Australian Open 2017: Melbourne Park grand entrance revamp ...
2016-10-01,Melbourne auction market returns with yet another strong result
2016-10-01,2017 Fixture: Where the Crows play
2016-10-01,Brent Harvey confirms retirement after North Melbourne release and ...
2016-10-01,Melbourne City star Tim Cahill's new goal is to get kids involved in ...
2016-10-01,The high cost of Melbourne's all night weekend public transport trial
2016-10-01,Three in hospital after truck slams into bus in Melbourne
2016-10-01,Ute crashes into elderly woman's Melbourne home
2016-10-01,Jason Doyle ruled out of Melbourne speedway grand prix by injury I ...
2016-10-01,Fadi Mansour spent a year stuck in an airport. Now he lives near ...
2016-10-01,"Melbourne, Sydney drive Transurban profits"
2016-10-01,Damien Oliver was adamant his ride on Flying Artyie was not ...
2016-10-01,"Melbourne coffee prices cheaper than Perth, Hobart despite ..."
2016-10-01,"2016 Melbourne Cup order of entry: news, odds, field update ..."
2016-10-01,Melbourne in April will be food-lovers heaven as world's top chefs ...
2016-10-01,Brothers spared jail after 'sickening' street attack near Melbourne ...
2016-10-01,Wife accidently runs over husband in Melbourne driveway
2016-10-01,Doubt cast over election of Melbourne Council's first Indigenous ...
2016-10-01,Melbourne too good for Adelaide in NBL
2016-10-01,"Melbourne Express: Friday, October 21, 2016"
2016-10-01,Locker room mentality' of Melbourne High student traditions ...
2016-10-01,Retired farming couple cash in almost $100 million as developers ...
2016-10-01,Woman attacked with knife while defending neighbour in Port ...
2016-10-01,Liberal MP billed taxpayers to fly to Melbourne's Derby Day races
2016-10-01,Melbourne 'sky rail' argument continues in court
2016-10-01,Melbourne marathon runner 'stoked to win' first race
2016-10-01,Echo Taskforce raids homes in Melbourne's southeast in relation to ...
2016-10-01,NRC: Rays rise above Melbourne in gusty conditions
2016-10-01,Man dies at Melbourne construction site
2016-10-01,"Former train employee, CFA volunteer jailed over Melbourne ..."
2016-10-01,"North Melbourne's possible line-up for Round 1, 2017 after Daniel ..."
2016-10-01,"That Banksy in Melbourne video, and the perils of anonymity"
2016-10-01,Usain Bolt parties at Melbourne nightclub Alumbra
2016-10-01,Driverless cars tested on Melbourne's roads
2016-10-01,The inconvenient truth behind Melbourne's population boom
2016-10-01,"Melbourne population flip: all out, all change"
2016-10-01,Police investigate after violent brawls break out in Melbourne and ...
2015-01-01,Melbourne 2015 ready for return on its tennis investment
2015-01-01,Serena Williams eases into second round in Melbourne
2015-01-01,Asian Cup 2015: Iran return to Melbourne for first time since ...
2015-01-01,Chaos erupts during Melbourne darts tournament as crowd throws ...
2015-01-01,Australian Open 2015: Gallery cheats are ruining the wonderful vibe ...
2015-01-01,Australian Open 2015: Veteran Martina Hingis chasing doubles ...
2015-01-01,Royal commission to examine child sexual abuse within Jewish ...
2015-01-01,Peanut allergy treatment success by Melbourne researchers brings ...
2015-01-01,Melbourne Islamic State recruit Suhan Rahman says he won't return ...
2015-01-01,Asian Cup: Uzbekistan beats Saudi Arabia 3-1 in Melbourne to ...
2015-01-01,Men charged over alleged $110m home loan conspiracy in Melbourne
2015-01-01,Uber driver arrested over alleged sex assault in Melbourne
2015-01-01,Melbourne weather: Heavy rain won't hit city until Monday
2015-01-01,Vic police smash Melbourne drug syndicate
2015-01-01,Asian Cup 2015: Socceroos star Robbie Kruse says Melbourne ...
2015-01-01,Roger Federer survives Simone Bolelli scare to advance in Melbourne
2015-01-01,A crash in gas use is more likely than the forecast 'shortage'
2015-01-01,Skydivers rescued as wild winds take Melbourne by surprise
2015-01-01,Teenage boy dies after hit-and-run in Melbourne's north-west
2015-01-01,Horrific footage of Melbourne karaoke bar gang attack
2015-01-01,"Melbourne weather: stinking hot one minute, storming the next"
2015-01-01,We're not vandals': Nylex clock switch flickers come forward
2015-01-01,"Australian Open 2015: Day 8 Schedule, Matchups Predictions for ..."
2015-01-01,Mystery surrounds murdered Melbourne society grandmother ...
2015-01-01,Melbourne Victory draw big crowd to A-League clash in Geelong
2015-01-01,Port of Melbourne automation project scooped by Finnish giant
2015-01-01,Maria Sharapova eases through in Melbourne
2015-01-01,Melbourne chocolate company Ernest Hillier goes into ...
2015-01-01,Nine arrested as police disrupt alleged Melbourne drug syndicate
2015-01-01,Aboriginal rights protest disrupts Australia Day Parade in Melbourne
2015-01-01,"Australian Open 2015: Day 2 Schedule, Matchups Predictions for ..."
2015-01-01,Melbourne jihadist 'killed in Syria'
2015-01-01,Hot in the city: Melbourne records the top overnight temperature for ...
2015-01-01,Dutch tourist 'in black hole' after six-week rape and torture ordeal at ...
2015-01-01,Serious sex offender Daniel Luke Walls found in Melbourne
2015-01-01,"Tram derailed, beer kegs strewn across Melbourne road after truck ..."
2015-01-01,Victorian Premier Daniel Andrews leads Melbourne Pride March ...
2015-01-01,Melbourne's tallest building goes on sale
2015-01-01,"Australian Open 2015: Day 7 Schedule, Matchups Predictions for ..."
2015-01-01,Three people develop measles after attending Melbourne RMIT ...
2015-01-01,Epic timelapse video shows why Melbourne is the world's most ...
2015-01-01,"Melbourne mall shooting 'hero' leaves behind wife, son"
2015-01-01,"Air China goes daily on Melbourne flights to Beijing, Shanghai"
2015-01-01,Petrol prices in Melbourne fall to six-year low; regional areas yet to ...
2015-01-01,Renegades and Stars chase crucial Melbourne derby win in Big ...
2015-01-01,Melbourne's top 10 best gelato spots
2015-01-01,Two men charged over Melbourne father's car boot death
2015-01-01,Renegades bowlers star in massive win
2015-01-01,Melbourne Tullamarine Airport's Tigerair terminal reopens after ...
2015-01-01,Former Melbourne Demon Cameron Johnston takes a punt on ...
2015-01-01,"Not One, But TWO Giant Slip N Slides Are Coming To Melbourne ..."
2015-01-01,Accused crayfish thief caught 'waving it down Melbourne street'
2015-01-01,Separation Tree in Melbourne's Botanic Gardens unlikely to survive
2015-01-01,Stockland to build 12000 Melbourne homes
2015-01-01,"Maria Sharapova and Eugenie Bouchard are charismatic, love the ..."
2015-01-01,Melbourne start-up poaches former Google director
2015-01-01,Indian restaurant in Melbourne banned from hiring foreign workers ...
2015-01-01,"Australian Open could be played entirely indoors, as Margaret Court ..."
2015-01-01,"Rafael Nadal defeats Mark Philippoussis, Omar Jasika and ..."
2015-01-01,Melbourne to Hobart yacht Seduction runs aground on return ...
2015-01-01,"Free CBD tram rides delight tourists, students"
2015-01-01,Traumatised' woman avoids jail over involvement in Melbourne ...
2015-01-01,Brian Waldron admits he was to blame for the Melbourne Storm ...
2015-01-01,Breakthrough in killing of Melbourne father Kenan Balikel
2015-01-01,Outgoing Perth Festival artistic director Jonathan Holloway to head ...
2015-01-01,Melbourne president of Hells Angels Darkside chapter jailed after ...
2015-01-01,Victoria weather: Melbourne soaked as 'tropical' conditions move ...
2015-01-01,Victim takes photo of alleged flasher at Melbourne's Sandringham ...
2015-01-01,Melbourne vigilantes claim to expose paedophiles in Tinder ...
2015-01-01,Fairfax Media pays $72 million to buy back its Melbourne real estate ...
2015-01-01,Melbourne train delays expected as drivers plan industrial action ...
2015-01-01,White Night Melbourne Reveals Full 2015 Program
2015-01-01,"Racist attacker, Madeline Luke, admits bashing female Melbourne ..."
2015-01-01,Public transport in Melbourne: new suite of timetable apps coming
2015-01-01,Melbourne artists use queer cartoons to empower
2015-01-01,Rats invade Melbourne as council admits baiting program failure
2015-01-01,Melbourne in the small hours is all go
2015-01-01,Melbourne Airport hit by fuel shortage
2015-01-01,Australian Open: Katie Swan turns eye on next prize after Melbourne ...
2015-01-01,State government to review high kill rates at Melbourne Lost Dogs ...
2015-01-01,Perth Scorchers to recall Nathan Coulter-Nile for fiery barrage on ...
2015-01-01,Stars shine at premiere of Strictly Ballroom the Musical in Melbourne
2015-01-01,Australian Open 2015: Serena Williams sets up Melbourne final with ...
2015-01-01,Melbourne men show how to conduct an unhelpful interview when ...
2015-01-01,Party time for Melbourne as Asian Cup kicks off in Australia
2015-01-01,Forty arrested for drug offences at Melbourne's Above and Beyond ...
2015-01-01,Fare evasion on Melbourne public transport at lowest recorded level
2015-01-01,"Court urged to lock up alleged armed terror fan, but Melbourne ..."
2015-01-01,Is Melbourne an intense place? Nowhere near intense enough for ...
2015-01-01,Inside Melbourne's maximum security purgatory
2015-01-01,"Scrabble squabble over cheating, playing ban settled in Melbourne ..."
2015-01-01,The 16 essential summer food experiences of Melbourne
2015-01-01,BBL04: Melbourne Stars cruise to victory over Sydney Thunder at ...
2015-01-01,Melbourne couple sue hospital over fatal home birth after 'midwife ...
2015-01-01,Mosquitoes infest Melbourne suburbs during sticky summer
2015-01-01,Video: Batman fan takes to Melbourne streets in own Batmobile
2015-01-01,Victoria weather: Melbourne sweats through hottest day of summer ...
2015-01-01,Help our homeless Diggers: The disgrace of our military veterans ...
2015-01-01,Schoolchildren still traumatised by murder of Melbourne Grammar ...
2015-01-01,Melbourne couple John Wylie and Myriam Boisbouvier-Wylie give ...
2015-02-01,Australian Open 2015: Novak Djokovic wins fifth Melbourne Park ...
2015-02-01,Melbourne becomes Mumbai in a sea of blue
2015-02-01,3D printing: Melbourne engineers print jet engine in world first
2015-02-01,Melbourne Jewish school sent pedophile teacher to Israel
2015-02-01,White Night Melbourne 2015: The best of an all-night spectacle
2015-02-01,"Melbourne Demons want to play AFL final in 2016, have 50000 ..."
2015-02-01,Melbourne's No. 2 draft pick Christian Petracca tears anterior ...
2015-02-01,Pedestrian killed by garbage truck at busy Melbourne CBD ...
2015-02-01,The Fat Duck Melbourne opens doors at Crown
2015-02-01,Brawl erupts inside Melbourne Magistrates' Court
2015-02-01,Melbourne Metro Rail Project funding 'fast-tracked'
2015-02-01,Men wanted for bashings spree in Melbourne's inner south
2015-02-01,"Real Housewives of Melbourne, episode 1 recap: New housewives ..."
2015-02-01,Melbourne puts rock icon Chrissy Amphlett on the map
2015-02-01,Police hunt killer who shot Melbourne man in the face
2015-02-01,Excited fans turn out to welcome Afghanistan cricket team to ...
2015-02-01,Real Housewives of Melbourne returns for season two
2015-02-01,Strong winds and heavy rain to hit Melbourne and regional Victoria
2015-02-01,Stuart Rattle murder: Partner who strangled prominent interior ...
2015-02-01,"Laneway Festival 2015 – Melbourne, 07/02/15"
2015-02-01,Melbourne man clings to life after jumping from a moving train
2015-02-01,Melbourne allowing high-rise development at rate that would never ...
2015-02-01,Cyclist 'car-doored' before being killed by passing truck in Melbourne
2015-02-01,"Work starts on new 1000-bed Ravenhall Prison in Melbourne, as ..."
2015-02-01,Man's body found on footpath in Collins St Melbourne
2015-02-01,Man 'shot in head' fighting for life in Melbourne hospital
2015-02-01,Melbourne IT to acquire Uber Global
2015-02-01,Melbourne's first Anglican female bishop dies
2015-02-01,More than 200 Coles jobs axed in Melbourne
2015-02-01,Zara Home is now open in Melbourne
2015-02-01,Police fear 'subculture' of dangerous behaviour on Melbourne's train ...
2015-02-01,"The Hi-Fi bar, Melbourne music institution goes bust"
2015-02-01,"Three Melbourne men arrested over alleged tax fraud, money ..."
2015-02-01,New Real Housewives of Melbourne star Pettifleur Berenger is ...
2015-02-01,Drug-addled driver jailed after crashing into Melbourne cafe
2015-02-01,White Night Melbourne 2015: Arts event heads big city crush of ...
2015-02-01,Waste-free cafe to close over compost dispute
2015-02-01,"Melbourne weather: Storms flood homes, delay flights"
2015-02-01,Real Housewives of Melbourne's Pettifleur Berenger embroiled in ...
2015-02-01,Melbourne beats Sydney in American students' Google searches for ...
2015-02-01,Adelaide's air traffic control could be 'cut' and moved to Melbourne in ...
2015-02-01,Melbourne and Sydney's live music scenes are changing ...
2015-02-01,Melbourne young guns Storm into NRL contention after strong trial ...
2015-02-01,Cereal Anytime: Australia's first cereal cafe opens in Melbourne
2015-02-01,Creator of the Real Housewives of Melbourne reveals what it takes ...
2015-02-01,"ANZ cuts 140 jobs from its Melbourne, Sydney offices"
2015-02-01,Melbourne's famous Keith Haring mural defaced by graffiti
2015-02-01,Homicide squad investigating Briar Hill death in Melbourne
2015-02-01,Trams that never stop at traffic lights could be part of Melbourne's ...
2015-02-01,Melbourne announces 2015 leaders
2015-02-01,Bland new station names for Melbourne Metro project reimagined
2015-02-01,Teachers launch crowdfunding campaign to open Sandridge School ...
2015-02-01,Man shot dead confronting intruder at home in Melbourne's west
2015-02-01,Melbourne weather: hot and getting hotter as summer kicks in
2015-02-01,Monash suburbs rank among Melbourne's top growth zones
2015-02-01,"Ferrari, Mercedes, Toyota for new Melbourne motor show"
2015-02-01,"Ford Opening New Melbourne Office, Transforming Broadmeadows ..."
2015-02-01,Scientology's secret riches revealed
2015-02-01,Prices picked to rise amid demand in Melbourne greenfield suburbs
2015-02-01,Melbourne's Royal Children's Hospital a world leader
2015-02-01,Final Soundwave 2015 Timetables Released
2015-02-01,Queen Victoria Market to be open every day and night
2015-02-01,The Fat Duck Melbourne
2015-02-01,Woman and guide dog fall onto Melbourne train tracks
2015-02-01,Aurecon completes 6 Star Melbourne fitout
2015-02-01,"Man wearing blonde wig, fishnets holds up Melbourne fast-food ..."
2015-02-01,Lean takings as tightwad diners exploit Lentil As Anything's philosophy
2015-02-01,Melbourne weather: City records its coldest January in 10 years
2015-02-01,Jewish security group not fearful of Melbourne attacks
2015-02-01,Melbourne ice cream maker Dairy Bell saved by Bon Appetit deal
2015-02-01,Large debt' sparked Chinatown killing in Melbourne's CBD
2015-02-01,"Rare 'Doctor Who' synthesiser, EMS Synthi 100, restored in ..."
2015-02-01,Melbourne's Testing Grounds project breathes life into dead urban ...
2015-02-01,"Melbourne weather: Coldest summer spell in 65 years, but warm ..."
2015-02-01,Yum charm: Melbourne's best yum cha restaurants
2015-02-01,Real Housewives of Melbourne star Lydia Schiavello flew to King ...
2015-02-01,Two Melbourne police officers charged with drug trafficking ...
2015-02-01,Here's Our Picks Of The 2015 Melbourne Comedy Festival Lineup
2015-02-01,Joost Bakker's waste-free cafe to close following council compost ...
2015-02-01,Melbourne's ghost sign hunters open windows to the past
2015-02-01,Petrol jumps to 124.9 cents at some Melbourne bowsers
2015-02-01,Melbourne weather: cricket fans hold hopes for clear skies for MCG ...
2015-02-01,Legal history: High Court to hear Melbourne death row dog case
2015-02-01,Melbourne level crossing removal plan to be fast-tracked ...
2015-02-01,"WiFi upgrade, more televisions as MCG revamps technology"
2015-02-01,Melbourne ticket inspectors nab passengers outside free tram zone
2015-02-01,French man charged with trying to smuggle cocaine through ...
2015-02-01,AFL v A-League — which sport has the best atmosphere for fans?
2015-02-01,Jesse Hogan kicks three goals in Melbourne's intra-club match
2015-02-01,"Arson attacks, shootings and assaults hit some Melbourne restaurants"
2015-02-01,Two people charged with murder over Melbourne balcony fall
2015-02-01,Sydney's Vivid Festival trolls Melbourne's White Night festival with ...
2015-02-01,The Lion King musical returns to Melbourne after grossing more ...
2015-02-01,"Eleven arrested as rifles, drugs, cash, cars seized in raids in ..."
2015-02-01,"Private Melbourne: fashion, festivals and Franks"
2015-02-01,Melbourne's White Night festival creates 'magical moments' around ...
2015-02-01,Stuck trucks: Are Melbourne truckies height challenged?
2015-02-01,David Bowie to be subject of Melbourne academic conference
2015-02-01,White Night Melbourne 2015: what you need to know about ...
2015-02-01,My Kitchen Rules: Melbourne's Ash and Camilla risk French menu
2015-03-01,Jake Bilardi: Melbourne teenager who joined Islamic State left bomb ...
2015-03-01,Melbourne Grand Prix: South Australia 'has itself to blame' for losing ...
2015-03-01,Australian Grand Prix: Lewis Hamilton wins in Melbourne ahead of ...
2015-03-01,Aussie cricket team still partying at dawn in Melbourne
2015-03-01,Teenage girl stabbed to death in Doncaster park in Melbourne's east
2015-03-01,Jill Meagher killer Adrian Bayley found guilty of three more rapes
2015-03-01,Melbourne police officers pull up Arnold Schwarzenegger for riding ...
2015-03-01,Melbourne priest apologises for derogatory comments about Jill ...
2015-03-01,Fernando Alonso to miss Australian Formula One Grand Prix in ...
2015-03-01,AirAsia X flight from Sydney to Malaysia back in the air after making ...
2015-03-01,Mother of murdered Melbourne teen says heartbreak will never heal
2015-03-01,Melbourne housing market recording slower annual growth than last ...
2015-03-01,Alleged paedophile Peter Gerard Scully fled a sordid past in ...
2015-03-01,"Melbourne had eye on grand prix since 1980s, claims retiring chief ..."
2015-03-01,Jake Bilardi: What we know about Melbourne teenager linked to ...
2015-03-01,Dulux to build new factory in Melbourne
2015-03-01,Suspected arson attack at third Melbourne Catholic church with links ...
2015-03-01,Essendon deny Melbourne in thriller
2015-03-01,Melbourne extremist Suhan Raham reportedly killed fighting for ...
2015-03-01,Thousands march in Melbourne on Palm Sunday to protest asylum ...
2015-03-01,Questions over Tony Abbott's VIP flight to Melbourne to attend ...
2015-03-01,"Fire destroys heritage-listed St James Church in Brighton, in ..."
2015-03-01,Malaria vaccine breakthrough by Melbourne researchers
2015-03-01,Melbourne: the world's sixth most expensive city
2015-03-01,Ritz-Carlton to feature in Melbourne CBD development
2015-03-01,Melbourne's planning disaster: jobs boom in CBD while affordable ...
2015-03-01,Police fear escalating violence in pokies hold-ups in Melbourne's ...
2015-03-01,A plan to turn Melbourne's Elizabeth Street into a rainforest canal
2015-03-01,MELBOURNE mother and son killed in the Germanwings Airbus ...
2015-03-01,Courtney Barnett's 'Depreston' song strikes a chord with first-home ...
2015-03-01,NAB Challenge: Melbourne defeats Western Bulldogs by seven ...
2015-03-01,"Earthquake hits Melbourne suburb of Pakenham, shakes homes"
2015-03-01,Dutch backpacker held hostage as sex slave by Alfio Anthony Granata
2015-03-01,Melbourne to ban smoking in outdoor eating areas under Mayor's ...
2015-03-01,Body discovered in burnt out car in Eumemmerring reserve in ...
2015-03-01,University of Melbourne study warns of harmful compounds found in ...
2015-03-01,Melbourne 'should bid' for 2032 Olympics
2015-03-01,Melbourne V Sydney – the Capital of Charity and Philanthropy
2015-03-01,Ballarat rail jobs saved as Daniel Andrews orders new trains for ...
2015-03-01,Melbourne Grand Prix: F1 driver Giedo van der Garde asks court to ...
2015-03-01,Speaker who uses wheelchair 'carried onto stage' at Melbourne ...
2015-03-01,Freo edge out Melbourne in NAB Challenge
2015-03-01,Suspected senior crime boss Rocco Arico arrested in Melbourne raids
2015-03-01,Melbourne's billion-dollar rail system sells passengers short
2015-03-01,Mashrafe out for Melbourne redemption
2015-03-01,Melbourne suicide bomber was weak'
2015-03-01,Melbourne's new mega play park opens for business
2015-03-01,Baby taken to wrong parents at St Vincent's Private Hospital in ...
2015-03-01,What Melbourne will look like in 2043
2015-03-01,Melbourne Cup Carnival brings in millions of dollars to Victoria's ...
2015-03-01,The mysterious Diner en Blanc in Melbourne – review
2015-03-01,Residents evacuated after Melbourne apartment building fire
2015-03-01,Melbourne rapper Remi takes hip-hop to the top to win Australian ...
2015-03-01,Melbourne storms: The Patch mourns boy killed in wild weather
2015-03-01,"Protesters “shut down Melbourne"" to fight against closure of ..."
2015-03-01,Brett Whiteley $4.5m art fraud case heard in Melbourne Magistrates ...
2015-03-01,Portrait building: Is the new face of Melbourne too shy?
2015-03-01,A comedian's guide to the Melbourne Comedy Festival
2015-03-01,Young man killed in workplace accident south-east of Melbourne
2015-03-01,The Gamble Stripper Rumor On 'Real Housewives of Melbourne' Is ...
2015-03-01,Australian cities boom as Melbourne closes in on Sydney
2015-03-01,Across the great divide - a tale of two Melbournes
2015-03-01,Tasmanian Minister to take Victorian Government to task over Port of ...
2015-03-01,Melbourne Might Finally Get Some Decent Public Transport Apps Now
2015-03-01,Rocco Arico: Suspected organised crime boss refused bail in ...
2015-03-01,Over 50 Drug Arrests At Future Music Festival Melbourne
2015-03-01,Melbourne childcare centres charge well above Productivity ...
2015-03-01,Melbourne City powers past Jets to boost play-off hopes
2015-03-01,Cyclist groups push for safety awareness campaigns after dooring ...
2015-03-01,Boost for Melbourne's Busiest Train Line
2015-03-01,Hearts melt for Melbourne's baby gorilla 'girl'
2015-03-01,Melbourne's own Monopoly Board
2015-03-01,Haileybury College buys Melbourne CBD office from Singapore ...
2015-03-01,Police are investigating the death of a Melbourne woman in Bali
2015-03-01,Train hits car in Melbourne's south-east
2015-03-01,Melbourne's safety ranking takes hit in Safe Cities Index 2015 amid ...
2015-03-01,Melbourne City scored late through James Brown to score an upset ...
2015-03-01,Melbourne homeless welfare capital as handouts draw interstaters
2015-03-01,Melbourne set to pay full cap
2015-03-01,Police release CCTV in hope of finding Melbourne mum's killer
